number,value,datetime_start,datetime_complete,duration,params_criterion,params_max_depth,params_min_samples_leaf,params_min_samples_split,params_n_estimators,state
0,0.6543328152831889,2026-06-08 13:35:59.646699,2026-06-08 13:35:59.806490,0 days 00:00:00.159791,gini,10,1,4,44,COMPLETE
1,0.6619332495937209,2026-06-08 13:35:59.806513,2026-06-08 13:36:00.016320,0 days 00:00:00.209807,log_loss,7,3,17,88,COMPLETE
2,0.6619261530164001,2026-06-08 13:36:00.016339,2026-06-08 13:36:00.116294,0 days 00:00:00.099955,entropy,4,7,7,26,COMPLETE
3,0.655400850169963,2026-06-08 13:36:00.116318,2026-06-08 13:36:00.224977,0 days 00:00:00.108659,log_loss,5,6,5,22,COMPLETE
4,0.6412893061676354,2026-06-08 13:36:00.224996,2026-06-08 13:36:00.385156,0 days 00:00:00.160160,gini,3,10,20,63,COMPLETE
5,0.669533683904253,2026-06-08 13:36:00.385178,2026-06-08 13:36:00.591511,0 days 00:00:00.206333,entropy,5,5,4,83,COMPLETE
6,0.6565114645206617,2026-06-08 13:36:00.591532,2026-06-08 13:36:00.691102,0 days 00:00:00.099570,entropy,10,6,11,13,COMPLETE
7,0.6380426220433885,2026-06-08 13:36:00.691125,2026-06-08 13:36:00.801464,0 days 00:00:00.110339,entropy,10,10,13,26,COMPLETE
8,0.6510541965609986,2026-06-08 13:36:00.801488,2026-06-08 13:36:00.909945,0 days 00:00:00.108457,log_loss,4,9,7,18,COMPLETE
9,0.6640906090992315,2026-06-08 13:36:00.909968,2026-06-08 13:36:01.069680,0 days 00:00:00.159712,log_loss,5,10,3,42,COMPLETE
10,0.6673727761100822,2026-06-08 13:36:01.069703,2026-06-08 13:36:01.286486,0 days 00:00:00.216783,entropy,7,4,10,98,COMPLETE
11,0.6684656490174788,2026-06-08 13:36:01.286505,2026-06-08 13:36:01.500321,0 days 00:00:00.213816,entropy,7,4,11,95,COMPLETE
12,0.6597723417995501,2026-06-08 13:36:01.500341,2026-06-08 13:36:01.700207,0 days 00:00:00.199866,entropy,8,4,15,75,COMPLETE
13,0.6630261225011177,2026-06-08 13:36:01.700227,2026-06-08 13:36:01.905849,0 days 00:00:00.205622,entropy,6,2,8,81,COMPLETE
14,0.6717229780077069,2026-06-08 13:36:01.905871,2026-06-08 13:36:02.135063,0 days 00:00:00.229192,entropy,8,4,2,97,COMPLETE
15,0.6641189954085145,2026-06-08 13:36:02.135086,2026-06-08 13:36:02.331474,0 days 00:00:00.196388,entropy,8,7,2,68,COMPLETE
16,0.6695478770588945,2026-06-08 13:36:02.331502,2026-06-08 13:36:02.542410,0 days 00:00:00.210908,gini,9,5,2,83,COMPLETE
17,0.6608332801090034,2026-06-08 13:36:02.542439,2026-06-08 13:36:02.760956,0 days 00:00:00.218517,gini,9,8,2,100,COMPLETE
18,0.6695514253475549,2026-06-08 13:36:02.760977,2026-06-08 13:36:02.925864,0 days 00:00:00.164887,gini,9,2,6,56,COMPLETE
19,0.6565114645206617,2026-06-08 13:36:02.925891,2026-06-08 13:36:03.090583,0 days 00:00:00.164692,gini,8,1,6,48,COMPLETE
20,0.6597652452222293,2026-06-08 13:36:03.090614,2026-06-08 13:36:03.250481,0 days 00:00:00.159867,gini,9,2,9,58,COMPLETE
21,0.6608616664182865,2026-06-08 13:36:03.250508,2026-06-08 13:36:03.458803,0 days 00:00:00.208295,gini,9,3,2,70,COMPLETE
22,0.6662834514913457,2026-06-08 13:36:03.458829,2026-06-08 13:36:03.695467,0 days 00:00:00.236638,gini,9,5,5,90,COMPLETE
23,0.6597758900882105,2026-06-08 13:36:03.695493,2026-06-08 13:36:03.857504,0 days 00:00:00.162011,gini,8,3,4,37,COMPLETE
24,0.6738980789565193,2026-06-08 13:36:03.857531,2026-06-08 13:36:04.069534,0 days 00:00:00.212003,gini,9,5,2,77,COMPLETE
25,0.6662799032026854,2026-06-08 13:36:04.069561,2026-06-08 13:36:04.234139,0 days 00:00:00.164578,gini,8,2,6,52,COMPLETE
26,0.6771660528127285,2026-06-08 13:36:04.234162,2026-06-08 13:36:04.447515,0 days 00:00:00.213353,gini,10,4,4,75,COMPLETE
27,0.677162504524068,2026-06-08 13:36:04.447547,2026-06-08 13:36:04.647174,0 days 00:00:00.199627,gini,10,4,3,77,COMPLETE
28,0.6575972408507377,2026-06-08 13:36:04.647193,2026-06-08 13:36:04.846462,0 days 00:00:00.199269,gini,10,6,4,75,COMPLETE
29,0.6576043374280585,2026-06-08 13:36:04.846493,2026-06-08 13:36:05.039891,0 days 00:00:00.193398,gini,10,7,4,75,COMPLETE
30,0.6825878378857877,2026-06-08 13:36:05.039913,2026-06-08 13:36:05.197328,0 days 00:00:00.157415,gini,10,5,8,67,COMPLETE
31,0.6847735837005812,2026-06-08 13:36:05.197354,2026-06-08 13:36:05.355937,0 days 00:00:00.158583,gini,10,5,8,64,COMPLETE
32,0.6695549736362153,2026-06-08 13:36:05.355964,2026-06-08 13:36:05.532025,0 days 00:00:00.176061,gini,10,4,9,63,COMPLETE
33,0.6662976446459873,2026-06-08 13:36:05.532048,2026-06-08 13:36:05.737042,0 days 00:00:00.204994,gini,10,3,8,68,COMPLETE
34,0.6630403156557593,2026-06-08 13:36:05.737071,2026-06-08 13:36:05.890929,0 days 00:00:00.153858,gini,10,6,13,62,COMPLETE
35,0.6652047717385905,2026-06-08 13:36:05.890949,2026-06-08 13:36:06.104157,0 days 00:00:00.213208,log_loss,10,5,8,88,COMPLETE
36,0.6608687629956073,2026-06-08 13:36:06.104180,2026-06-08 13:36:06.315101,0 days 00:00:00.210921,gini,10,6,13,70,COMPLETE
37,0.6630332190784385,2026-06-08 13:36:06.315128,2026-06-08 13:36:06.470262,0 days 00:00:00.155134,gini,9,4,5,59,COMPLETE
38,0.6662728066253646,2026-06-08 13:36:06.470282,2026-06-08 13:36:06.696578,0 days 00:00:00.226296,gini,6,7,18,86,COMPLETE
39,0.6651941268726094,2026-06-08 13:36:06.696605,2026-06-08 13:36:06.870406,0 days 00:00:00.173801,log_loss,10,5,7,66,COMPLETE
40,0.6510648414269797,2026-06-08 13:36:06.870451,2026-06-08 13:36:07.031509,0 days 00:00:00.161058,gini,3,3,10,51,COMPLETE
41,0.6662905480686665,2026-06-08 13:36:07.031539,2026-06-08 13:36:07.231192,0 days 00:00:00.199653,gini,9,5,3,79,COMPLETE
42,0.6717229780077069,2026-06-08 13:36:07.231218,2026-06-08 13:36:07.427419,0 days 00:00:00.196201,gini,10,5,3,77,COMPLETE
43,0.6641260919858353,2026-06-08 13:36:07.427441,2026-06-08 13:36:07.642461,0 days 00:00:00.215020,gini,9,4,6,73,COMPLETE
44,0.6619367978823814,2026-06-08 13:36:07.642484,2026-06-08 13:36:07.798807,0 days 00:00:00.156323,gini,10,6,4,64,COMPLETE
45,0.6652012234499302,2026-06-08 13:36:07.798825,2026-06-08 13:36:07.996430,0 days 00:00:00.197605,log_loss,9,5,5,81,COMPLETE
46,0.6640941573878918,2026-06-08 13:36:07.996449,2026-06-08 13:36:08.197806,0 days 00:00:00.201357,gini,10,4,12,71,COMPLETE
47,0.6554114950359441,2026-06-08 13:36:08.197828,2026-06-08 13:36:08.399398,0 days 00:00:00.201570,gini,10,8,3,92,COMPLETE
48,0.670647846543612,2026-06-08 13:36:08.399420,2026-06-08 13:36:08.605015,0 days 00:00:00.205595,gini,7,6,7,85,COMPLETE
49,0.6641154471198542,2026-06-08 13:36:08.605037,2026-06-08 13:36:08.761317,0 days 00:00:00.156280,log_loss,9,4,10,60,COMPLETE
50,0.6728087543377829,2026-06-08 13:36:08.761338,2026-06-08 13:36:08.963609,0 days 00:00:00.202271,gini,10,5,3,78,COMPLETE
51,0.6717229780077069,2026-06-08 13:36:08.963629,2026-06-08 13:36:09.164184,0 days 00:00:00.200555,gini,10,5,3,77,COMPLETE
52,0.67390517553384,2026-06-08 13:36:09.164203,2026-06-08 13:36:09.365613,0 days 00:00:00.201410,gini,10,4,5,81,COMPLETE
53,0.6619474427483625,2026-06-08 13:36:09.365636,2026-06-08 13:36:09.575794,0 days 00:00:00.210158,gini,10,3,5,82,COMPLETE
54,0.6651870302952886,2026-06-08 13:36:09.575812,2026-06-08 13:36:09.785490,0 days 00:00:00.209678,gini,9,4,9,94,COMPLETE
55,0.6739016272451797,2026-06-08 13:36:09.785509,2026-06-08 13:36:09.989319,0 days 00:00:00.203810,gini,10,4,5,68,COMPLETE
56,0.6652225131818924,2026-06-08 13:36:09.989343,2026-06-08 13:36:10.194582,0 days 00:00:00.205239,entropy,10,3,6,66,COMPLETE
57,0.6749767587092745,2026-06-08 13:36:10.194606,2026-06-08 13:36:10.398985,0 days 00:00:00.204379,gini,6,4,8,72,COMPLETE
58,0.6771518596580869,2026-06-08 13:36:10.399007,2026-06-08 13:36:10.606056,0 days 00:00:00.207049,gini,6,4,7,73,COMPLETE
59,0.6771412147921058,2026-06-08 13:36:10.606078,2026-06-08 13:36:10.771599,0 days 00:00:00.165521,gini,6,3,8,54,COMPLETE
