number,value,datetime_start,datetime_complete,duration,params_criterion,params_max_depth,params_min_samples_leaf,params_min_samples_split,params_n_estimators,state
0,0.8462518553176525,2026-06-08 13:39:44.358861,2026-06-08 13:39:44.540476,0 days 00:00:00.181615,gini,10,1,4,44,COMPLETE
1,0.8412526669898358,2026-06-08 13:39:44.540495,2026-06-08 13:39:44.796178,0 days 00:00:00.255683,log_loss,7,3,17,88,COMPLETE
2,0.813250539021562,2026-06-08 13:39:44.796208,2026-06-08 13:39:44.949312,0 days 00:00:00.153104,entropy,4,7,7,26,COMPLETE
3,0.8252522275996285,2026-06-08 13:39:44.949347,2026-06-08 13:39:45.098772,0 days 00:00:00.149425,log_loss,5,6,5,22,COMPLETE
4,0.8099987890525856,2026-06-08 13:39:45.098803,2026-06-08 13:39:45.303015,0 days 00:00:00.204212,gini,3,10,20,63,COMPLETE
5,0.8315015410524295,2026-06-08 13:39:45.303046,2026-06-08 13:39:45.550188,0 days 00:00:00.247142,entropy,5,5,4,83,COMPLETE
6,0.8172517267247846,2026-06-08 13:39:45.550210,2026-06-08 13:39:45.667491,0 days 00:00:00.117281,entropy,10,6,11,13,COMPLETE
7,0.8407527294117383,2026-06-08 13:39:45.667522,2026-06-08 13:39:45.827738,0 days 00:00:00.160216,entropy,10,10,13,26,COMPLETE
8,0.806251975287675,2026-06-08 13:39:45.827782,2026-06-08 13:39:45.933435,0 days 00:00:00.105653,log_loss,4,9,7,18,COMPLETE
9,0.8227506651775388,2026-06-08 13:39:45.933469,2026-06-08 13:39:46.090241,0 days 00:00:00.156772,log_loss,5,10,3,42,COMPLETE
10,0.8470014805050589,2026-06-08 13:39:46.090270,2026-06-08 13:39:46.295019,0 days 00:00:00.204749,gini,8,1,10,56,COMPLETE
11,0.8427513550051681,2026-06-08 13:39:46.295043,2026-06-08 13:39:46.504684,0 days 00:00:00.209641,gini,8,1,11,56,COMPLETE
12,0.8392504797863634,2026-06-08 13:39:46.504713,2026-06-08 13:39:46.683748,0 days 00:00:00.179035,gini,8,1,8,41,COMPLETE
13,0.8455014803176056,2026-06-08 13:39:46.683781,2026-06-08 13:39:46.909925,0 days 00:00:00.226144,gini,9,3,2,70,COMPLETE
14,0.8405004174581876,2026-06-08 13:39:46.909951,2026-06-08 13:39:47.096255,0 days 00:00:00.186304,gini,9,3,14,43,COMPLETE
15,0.8450006054737074,2026-06-08 13:39:47.096292,2026-06-08 13:39:47.328687,0 days 00:00:00.232395,gini,7,2,9,72,COMPLETE
16,0.8445016051614104,2026-06-08 13:39:47.328710,2026-06-08 13:39:47.621850,0 days 00:00:00.293140,gini,9,4,14,100,COMPLETE
17,0.8414993553485823,2026-06-08 13:39:47.621875,2026-06-08 13:39:47.836042,0 days 00:00:00.214167,gini,8,1,5,51,COMPLETE
18,0.8362491672393361,2026-06-08 13:39:47.836073,2026-06-08 13:39:48.003048,0 days 00:00:00.166975,gini,10,2,17,33,COMPLETE
19,0.838502166771078,2026-06-08 13:39:48.003083,2026-06-08 13:39:48.209082,0 days 00:00:00.205999,gini,6,8,9,59,COMPLETE
20,0.8437508552550432,2026-06-08 13:39:48.209110,2026-06-08 13:39:48.401391,0 days 00:00:00.192281,gini,9,4,11,50,COMPLETE
21,0.8445021675208907,2026-06-08 13:39:48.401422,2026-06-08 13:39:48.644607,0 days 00:00:00.243185,gini,9,2,2,68,COMPLETE
22,0.8455012928644455,2026-06-08 13:39:48.644634,2026-06-08 13:39:48.887179,0 days 00:00:00.242545,gini,8,3,2,76,COMPLETE
23,0.8437514176145235,2026-06-08 13:39:48.887206,2026-06-08 13:39:49.098041,0 days 00:00:00.210835,gini,10,1,5,64,COMPLETE
24,0.8445001055361292,2026-06-08 13:39:49.098071,2026-06-08 13:39:49.345776,0 days 00:00:00.247705,gini,9,2,6,79,COMPLETE
25,0.8367515417085155,2026-06-08 13:39:49.345807,2026-06-08 13:39:49.529404,0 days 00:00:00.183597,gini,7,4,3,49,COMPLETE
26,0.8390009796302148,2026-06-08 13:39:49.529437,2026-06-08 13:39:49.689200,0 days 00:00:00.159763,gini,8,3,2,32,COMPLETE
27,0.8467517928957502,2026-06-08 13:39:49.689235,2026-06-08 13:39:49.995170,0 days 00:00:00.305935,gini,10,1,4,96,COMPLETE
28,0.8435024798178555,2026-06-08 13:39:49.995200,2026-06-08 13:39:50.301194,0 days 00:00:00.305994,log_loss,10,1,9,96,COMPLETE
29,0.8377525415836717,2026-06-08 13:39:50.301226,2026-06-08 13:39:50.568392,0 days 00:00:00.267166,entropy,7,2,7,88,COMPLETE
30,0.8345028535994569,2026-06-08 13:39:50.568425,2026-06-08 13:39:50.722061,0 days 00:00:00.153636,log_loss,6,5,13,35,COMPLETE
31,0.8440020424896328,2026-06-08 13:39:50.722097,2026-06-08 13:39:50.993750,0 days 00:00:00.271653,gini,9,2,3,91,COMPLETE
32,0.8490012308174495,2026-06-08 13:39:50.993779,2026-06-08 13:39:51.216819,0 days 00:00:00.223040,gini,10,3,4,70,COMPLETE
33,0.8470011055987386,2026-06-08 13:39:51.216847,2026-06-08 13:39:51.433740,0 days 00:00:00.216893,gini,10,1,4,60,COMPLETE
34,0.8470011055987386,2026-06-08 13:39:51.433773,2026-06-08 13:39:51.644917,0 days 00:00:00.211144,gini,10,1,4,60,COMPLETE
35,0.8529994192701099,2026-06-08 13:39:51.644947,2026-06-08 13:39:51.844975,0 days 00:00:00.200028,gini,10,1,6,60,COMPLETE
36,0.8482516056300432,2026-06-08 13:39:51.845002,2026-06-08 13:39:52.071824,0 days 00:00:00.226822,gini,10,3,6,65,COMPLETE
37,0.8457517302863947,2026-06-08 13:39:52.071847,2026-06-08 13:39:52.311749,0 days 00:00:00.239902,entropy,9,4,6,65,COMPLETE
38,0.8455029799428867,2026-06-08 13:39:52.311784,2026-06-08 13:39:52.564740,0 days 00:00:00.252956,gini,10,7,8,76,COMPLETE
39,0.841251354817715,2026-06-08 13:39:52.564767,2026-06-08 13:39:52.760207,0 days 00:00:00.195440,entropy,8,5,6,54,COMPLETE
40,0.8044987258808706,2026-06-08 13:39:52.760237,2026-06-08 13:39:53.015646,0 days 00:00:00.255409,log_loss,3,3,10,84,COMPLETE
41,0.8420021047240821,2026-06-08 13:39:53.015675,2026-06-08 13:39:53.222945,0 days 00:00:00.207270,gini,10,2,5,60,COMPLETE
42,0.8450026674584689,2026-06-08 13:39:53.222981,2026-06-08 13:39:53.454727,0 days 00:00:00.231746,gini,10,1,7,69,COMPLETE
43,0.8427517299114884,2026-06-08 13:39:53.454756,2026-06-08 13:39:53.652526,0 days 00:00:00.197770,gini,10,2,5,56,COMPLETE
44,0.8427521048178087,2026-06-08 13:39:53.652552,2026-06-08 13:39:53.853946,0 days 00:00:00.201394,gini,9,3,4,47,COMPLETE
45,0.8457522926458751,2026-06-08 13:39:53.853979,2026-06-08 13:39:54.097583,0 days 00:00:00.243604,gini,10,1,8,74,COMPLETE
46,0.8460012304425432,2026-06-08 13:39:54.097612,2026-06-08 13:39:54.300625,0 days 00:00:00.203013,gini,9,6,6,65,COMPLETE
47,0.8422525421460313,2026-06-08 13:39:54.300655,2026-06-08 13:39:54.506252,0 days 00:00:00.205597,entropy,10,2,18,54,COMPLETE
48,0.8447520425833596,2026-06-08 13:39:54.506277,2026-06-08 13:39:54.705099,0 days 00:00:00.198822,gini,9,4,12,61,COMPLETE
49,0.8472513555675275,2026-06-08 13:39:54.705121,2026-06-08 13:39:54.974515,0 days 00:00:00.269394,log_loss,10,7,3,80,COMPLETE
50,0.8330022910525233,2026-06-08 13:39:54.974545,2026-06-08 13:39:55.220212,0 days 00:00:00.245667,log_loss,6,7,3,80,COMPLETE
51,0.8422516048802304,2026-06-08 13:39:55.220243,2026-06-08 13:39:55.457405,0 days 00:00:00.237162,log_loss,10,8,3,68,COMPLETE
52,0.8400010422395704,2026-06-08 13:39:55.457431,2026-06-08 13:39:55.710698,0 days 00:00:00.253267,log_loss,10,6,4,72,COMPLETE
53,0.8430036669587188,2026-06-08 13:39:55.710725,2026-06-08 13:39:55.901990,0 days 00:00:00.191265,log_loss,9,8,6,57,COMPLETE
54,0.8442532297242226,2026-06-08 13:39:55.902023,2026-06-08 13:39:56.156004,0 days 00:00:00.253981,log_loss,10,5,7,84,COMPLETE
55,0.840749730161176,2026-06-08 13:39:56.156036,2026-06-08 13:39:56.353574,0 days 00:00:00.197538,gini,9,1,10,63,COMPLETE
56,0.845750793020594,2026-06-08 13:39:56.353594,2026-06-08 13:39:56.559102,0 days 00:00:00.205508,gini,8,7,5,67,COMPLETE
57,0.8472507932080472,2026-06-08 13:39:56.559133,2026-06-08 13:39:56.751599,0 days 00:00:00.192466,gini,10,9,4,52,COMPLETE
58,0.8280025403652264,2026-06-08 13:39:56.751625,2026-06-08 13:39:56.912279,0 days 00:00:00.160654,gini,5,10,15,46,COMPLETE
59,0.8412507924582345,2026-06-08 13:39:56.912311,2026-06-08 13:39:57.109172,0 days 00:00:00.196861,gini,9,9,3,51,COMPLETE
