number,value,datetime_start,datetime_complete,duration,params_criterion,params_max_depth,params_min_samples_leaf,params_min_samples_split,params_n_estimators,state
0,0.7539897621198435,2026-06-08 13:34:07.160842,2026-06-08 13:34:07.301152,0 days 00:00:00.140310,gini,10,1,4,44,COMPLETE
1,0.7539897621198435,2026-06-08 13:34:07.301173,2026-06-08 13:34:07.500368,0 days 00:00:00.199195,log_loss,7,3,17,88,COMPLETE
2,0.7335140018066847,2026-06-08 13:34:07.500386,2026-06-08 13:34:07.593718,0 days 00:00:00.093332,entropy,4,7,7,26,COMPLETE
3,0.7416942687945398,2026-06-08 13:34:07.593743,2026-06-08 13:34:07.685792,0 days 00:00:00.092049,log_loss,5,6,5,22,COMPLETE
4,0.7458596808190304,2026-06-08 13:34:07.685816,2026-06-08 13:34:07.830491,0 days 00:00:00.144675,gini,3,10,20,63,COMPLETE
5,0.7540901334939276,2026-06-08 13:34:07.830509,2026-06-08 13:34:08.018993,0 days 00:00:00.188484,entropy,5,5,4,83,COMPLETE
6,0.7498745357823949,2026-06-08 13:34:08.019015,2026-06-08 13:34:08.108361,0 days 00:00:00.089346,entropy,10,6,11,13,COMPLETE
7,0.7417444544815819,2026-06-08 13:34:08.108383,2026-06-08 13:34:08.203607,0 days 00:00:00.095224,entropy,10,10,13,26,COMPLETE
8,0.7457593094449463,2026-06-08 13:34:08.203631,2026-06-08 13:34:08.296183,0 days 00:00:00.092552,log_loss,4,9,7,18,COMPLETE
9,0.7335641874937268,2026-06-08 13:34:08.296209,2026-06-08 13:34:08.437550,0 days 00:00:00.141341,log_loss,5,10,3,42,COMPLETE
10,0.7459098665060725,2026-06-08 13:34:08.437572,2026-06-08 13:34:08.636890,0 days 00:00:00.199318,entropy,7,4,10,98,COMPLETE
11,0.7540399478068855,2026-06-08 13:34:08.636914,2026-06-08 13:34:08.792449,0 days 00:00:00.155535,gini,9,1,2,67,COMPLETE
12,0.758104988457292,2026-06-08 13:34:08.792470,2026-06-08 13:34:08.959280,0 days 00:00:00.166810,gini,8,1,2,73,COMPLETE
13,0.7459098665060725,2026-06-08 13:34:08.959304,2026-06-08 13:34:09.148972,0 days 00:00:00.189668,gini,8,3,7,78,COMPLETE
14,0.7459098665060725,2026-06-08 13:34:09.148994,2026-06-08 13:34:09.342323,0 days 00:00:00.193329,gini,6,4,2,79,COMPLETE
15,0.7581551741443341,2026-06-08 13:34:09.342345,2026-06-08 13:34:09.545375,0 days 00:00:00.203030,entropy,8,2,5,99,COMPLETE
16,0.7663354411321892,2026-06-08 13:34:09.545399,2026-06-08 13:34:09.743959,0 days 00:00:00.198560,gini,8,2,9,100,COMPLETE
17,0.766285255445147,2026-06-08 13:34:09.743976,2026-06-08 13:34:09.939565,0 days 00:00:00.195589,entropy,8,2,9,100,COMPLETE
18,0.7499749071564791,2026-06-08 13:34:09.939584,2026-06-08 13:34:10.135759,0 days 00:00:00.196175,entropy,9,3,14,90,COMPLETE
19,0.7622202147947407,2026-06-08 13:34:10.135780,2026-06-08 13:34:10.275059,0 days 00:00:00.139279,gini,9,2,9,54,COMPLETE
20,0.7458596808190304,2026-06-08 13:34:10.275081,2026-06-08 13:34:10.464627,0 days 00:00:00.189546,entropy,7,8,13,91,COMPLETE
21,0.7621700291076986,2026-06-08 13:34:10.464649,2026-06-08 13:34:10.604771,0 days 00:00:00.140122,gini,9,2,9,50,COMPLETE
22,0.7663354411321892,2026-06-08 13:34:10.604795,2026-06-08 13:34:10.749189,0 days 00:00:00.144394,gini,8,2,9,57,COMPLETE
23,0.7540399478068855,2026-06-08 13:34:10.749212,2026-06-08 13:34:10.893917,0 days 00:00:00.144705,gini,8,4,8,63,COMPLETE
24,0.7621700291076986,2026-06-08 13:34:10.893934,2026-06-08 13:34:11.016775,0 days 00:00:00.122841,gini,7,2,12,35,COMPLETE
25,0.7417444544815819,2026-06-08 13:34:11.016800,2026-06-08 13:34:11.216640,0 days 00:00:00.199840,gini,6,5,15,99,COMPLETE
26,0.7417444544815819,2026-06-08 13:34:11.216660,2026-06-08 13:34:11.412241,0 days 00:00:00.195581,gini,8,3,11,92,COMPLETE
27,0.7663856268192312,2026-06-08 13:34:11.412259,2026-06-08 13:34:11.570592,0 days 00:00:00.158333,gini,6,1,9,70,COMPLETE
28,0.7663354411321892,2026-06-08 13:34:11.570612,2026-06-08 13:34:11.716915,0 days 00:00:00.146303,gini,6,1,6,70,COMPLETE
29,0.7622704004817825,2026-06-08 13:34:11.716936,2026-06-08 13:34:11.857154,0 days 00:00:00.140218,gini,6,1,10,46,COMPLETE
30,0.7621700291076984,2026-06-08 13:34:11.857176,2026-06-08 13:34:12.004089,0 days 00:00:00.146913,gini,7,1,17,59,COMPLETE
31,0.7663354411321892,2026-06-08 13:34:12.004110,2026-06-08 13:34:12.154419,0 days 00:00:00.150309,gini,6,1,6,72,COMPLETE
32,0.7458596808190304,2026-06-08 13:34:12.154439,2026-06-08 13:34:12.316731,0 days 00:00:00.162292,gini,5,2,8,71,COMPLETE
33,0.7662350697581051,2026-06-08 13:34:12.316753,2026-06-08 13:34:12.460952,0 days 00:00:00.144199,gini,7,1,6,56,COMPLETE
34,0.7622202147947407,2026-06-08 13:34:12.460973,2026-06-08 13:34:12.657045,0 days 00:00:00.196072,log_loss,6,3,8,84,COMPLETE
35,0.750075278530563,2026-06-08 13:34:12.657069,2026-06-08 13:34:12.795236,0 days 00:00:00.138167,gini,4,3,10,36,COMPLETE
36,0.7622704004817825,2026-06-08 13:34:12.795259,2026-06-08 13:34:12.942131,0 days 00:00:00.146872,gini,5,2,5,65,COMPLETE
37,0.7459098665060724,2026-06-08 13:34:12.942151,2026-06-08 13:34:13.131771,0 days 00:00:00.189620,gini,3,1,6,77,COMPLETE
38,0.7458094951319884,2026-06-08 13:34:13.131792,2026-06-08 13:34:13.275935,0 days 00:00:00.144143,log_loss,6,7,12,60,COMPLETE
39,0.7500250928435211,2026-06-08 13:34:13.275957,2026-06-08 13:34:13.453563,0 days 00:00:00.177606,gini,7,4,4,84,COMPLETE
40,0.749924721469437,2026-06-08 13:34:13.453585,2026-06-08 13:34:13.605891,0 days 00:00:00.152306,gini,10,5,20,68,COMPLETE
41,0.758155174144334,2026-06-08 13:34:13.605915,2026-06-08 13:34:13.786841,0 days 00:00:00.180926,gini,6,1,7,74,COMPLETE
42,0.7622704004817825,2026-06-08 13:34:13.786886,2026-06-08 13:34:13.930174,0 days 00:00:00.143288,gini,5,1,6,53,COMPLETE
43,0.7540399478068855,2026-06-08 13:34:13.930199,2026-06-08 13:34:14.082759,0 days 00:00:00.152560,gini,6,2,4,69,COMPLETE
44,0.7663856268192312,2026-06-08 13:34:14.082786,2026-06-08 13:34:14.231451,0 days 00:00:00.148665,log_loss,5,1,8,61,COMPLETE
45,0.7704506674696376,2026-06-08 13:34:14.231475,2026-06-08 13:34:14.372466,0 days 00:00:00.140991,log_loss,4,2,11,44,COMPLETE
46,0.7499247214694368,2026-06-08 13:34:14.372491,2026-06-08 13:34:14.512706,0 days 00:00:00.140215,log_loss,4,3,12,38,COMPLETE
47,0.7499247214694368,2026-06-08 13:34:14.512732,2026-06-08 13:34:14.610382,0 days 00:00:00.097650,log_loss,3,2,10,31,COMPLETE
48,0.7663354411321892,2026-06-08 13:34:14.610407,2026-06-08 13:34:14.753980,0 days 00:00:00.143573,log_loss,4,2,11,47,COMPLETE
49,0.7704004817825956,2026-06-08 13:34:14.754000,2026-06-08 13:34:14.905525,0 days 00:00:00.151525,log_loss,5,3,9,40,COMPLETE
50,0.7498243500953529,2026-06-08 13:34:14.905553,2026-06-08 13:34:15.048492,0 days 00:00:00.142939,log_loss,5,4,8,41,COMPLETE
51,0.7540901334939276,2026-06-08 13:34:15.048517,2026-06-08 13:34:15.195505,0 days 00:00:00.146988,log_loss,4,3,9,50,COMPLETE
52,0.7704506674696376,2026-06-08 13:34:15.195529,2026-06-08 13:34:15.291665,0 days 00:00:00.096136,log_loss,5,2,10,25,COMPLETE
53,0.758155174144334,2026-06-08 13:34:15.291686,2026-06-08 13:34:15.386975,0 days 00:00:00.095289,log_loss,5,3,11,20,COMPLETE
54,0.7622704004817825,2026-06-08 13:34:15.386997,2026-06-08 13:34:15.484823,0 days 00:00:00.097826,log_loss,5,1,10,25,COMPLETE
55,0.7498745357823949,2026-06-08 13:34:15.484847,2026-06-08 13:34:15.583325,0 days 00:00:00.098478,log_loss,4,2,13,31,COMPLETE
56,0.749924721469437,2026-06-08 13:34:15.583351,2026-06-08 13:34:15.673904,0 days 00:00:00.090553,log_loss,5,2,7,14,COMPLETE
57,0.7663354411321892,2026-06-08 13:34:15.673928,2026-06-08 13:34:15.771756,0 days 00:00:00.097828,log_loss,4,1,9,30,COMPLETE
58,0.7459098665060724,2026-06-08 13:34:15.771778,2026-06-08 13:34:15.863552,0 days 00:00:00.091774,log_loss,3,3,11,10,COMPLETE
59,0.7663354411321892,2026-06-08 13:34:15.863580,2026-06-08 13:34:16.009966,0 days 00:00:00.146386,log_loss,5,2,8,42,COMPLETE
