number,value,datetime_start,datetime_complete,duration,params_criterion,params_max_depth,params_min_samples_leaf,params_min_samples_split,params_n_estimators,state
0,0.9108136963318844,2026-06-08 13:34:40.342034,2026-06-08 13:34:40.480909,0 days 00:00:00.138875,gini,10,1,4,44,COMPLETE
1,0.9214901243041257,2026-06-08 13:34:40.480931,2026-06-08 13:34:40.673820,0 days 00:00:00.192889,log_loss,7,3,17,88,COMPLETE
2,0.914245405322962,2026-06-08 13:34:40.673843,2026-06-08 13:34:40.765385,0 days 00:00:00.091542,entropy,4,7,7,26,COMPLETE
3,0.9071150766415008,2026-06-08 13:34:40.765407,2026-06-08 13:34:40.857863,0 days 00:00:00.092456,log_loss,5,6,5,22,COMPLETE
4,0.9213376039045222,2026-06-08 13:34:40.857886,2026-06-08 13:34:41.000920,0 days 00:00:00.143034,gini,3,10,20,63,COMPLETE
5,0.9215282544040265,2026-06-08 13:34:41.000938,2026-06-08 13:34:41.192717,0 days 00:00:00.191779,entropy,5,5,4,83,COMPLETE
6,0.8929306794783803,2026-06-08 13:34:41.192738,2026-06-08 13:34:41.276555,0 days 00:00:00.083817,entropy,10,6,11,13,COMPLETE
7,0.8999084877602379,2026-06-08 13:34:41.276578,2026-06-08 13:34:41.371353,0 days 00:00:00.094775,entropy,10,10,13,26,COMPLETE
8,0.9142072752230611,2026-06-08 13:34:41.371377,2026-06-08 13:34:41.463305,0 days 00:00:00.091928,log_loss,4,9,7,18,COMPLETE
9,0.9142835354228628,2026-06-08 13:34:41.463330,2026-06-08 13:34:41.602730,0 days 00:00:00.139400,log_loss,5,10,3,42,COMPLETE
10,0.9321665522763669,2026-06-08 13:34:41.602753,2026-06-08 13:34:41.798467,0 days 00:00:00.195714,entropy,7,4,10,98,COMPLETE
11,0.9250362235949058,2026-06-08 13:34:41.798487,2026-06-08 13:34:41.994079,0 days 00:00:00.195592,entropy,7,4,11,95,COMPLETE
12,0.9214519942042249,2026-06-08 13:34:41.994100,2026-06-08 13:34:42.194999,0 days 00:00:00.200899,entropy,8,3,11,100,COMPLETE
13,0.9251124837947075,2026-06-08 13:34:42.195019,2026-06-08 13:34:42.358311,0 days 00:00:00.163292,entropy,8,4,14,74,COMPLETE
14,0.9250743536948067,2026-06-08 13:34:42.358331,2026-06-08 13:34:42.516834,0 days 00:00:00.158503,entropy,8,1,15,71,COMPLETE
15,0.9285823228856859,2026-06-08 13:34:42.516855,2026-06-08 13:34:42.702554,0 days 00:00:00.185699,entropy,8,3,8,78,COMPLETE
16,0.9143597956226645,2026-06-08 13:34:42.702573,2026-06-08 13:34:42.892903,0 days 00:00:00.190330,gini,9,2,8,81,COMPLETE
17,0.924998093495005,2026-06-08 13:34:42.892921,2026-06-08 13:34:43.039450,0 days 00:00:00.146529,entropy,6,8,8,56,COMPLETE
18,0.9214901243041257,2026-06-08 13:34:43.039468,2026-06-08 13:34:43.248528,0 days 00:00:00.209060,entropy,6,4,9,92,COMPLETE
19,0.9108136963318844,2026-06-08 13:34:43.248551,2026-06-08 13:34:43.436983,0 days 00:00:00.188432,gini,9,2,2,75,COMPLETE
20,0.9214901243041257,2026-06-08 13:34:43.437021,2026-06-08 13:34:43.585256,0 days 00:00:00.148235,entropy,7,5,6,62,COMPLETE
21,0.9251124837947075,2026-06-08 13:34:43.585280,2026-06-08 13:34:43.752747,0 days 00:00:00.167467,entropy,8,4,14,73,COMPLETE
22,0.9179440250133455,2026-06-08 13:34:43.752767,2026-06-08 13:34:43.951934,0 days 00:00:00.199167,entropy,9,3,16,83,COMPLETE
23,0.9178677648135438,2026-06-08 13:34:43.951960,2026-06-08 13:34:44.114701,0 days 00:00:00.162741,entropy,8,5,13,68,COMPLETE
24,0.9286204529855868,2026-06-08 13:34:44.114732,2026-06-08 13:34:44.306917,0 days 00:00:00.192185,entropy,7,2,10,100,COMPLETE
25,0.9214901243041257,2026-06-08 13:34:44.306940,2026-06-08 13:34:44.506678,0 days 00:00:00.199738,entropy,6,2,9,95,COMPLETE
26,0.9286204529855868,2026-06-08 13:34:44.506700,2026-06-08 13:34:44.699404,0 days 00:00:00.192704,entropy,7,2,10,99,COMPLETE
27,0.9250743536948067,2026-06-08 13:34:44.699427,2026-06-08 13:34:44.896907,0 days 00:00:00.197480,entropy,7,1,10,100,COMPLETE
28,0.9214901243041257,2026-06-08 13:34:44.896931,2026-06-08 13:34:45.088751,0 days 00:00:00.191820,log_loss,6,2,12,89,COMPLETE
29,0.9107755662319835,2026-06-08 13:34:45.088780,2026-06-08 13:34:45.228749,0 days 00:00:00.139969,gini,7,1,10,39,COMPLETE
30,0.9179440250133455,2026-06-08 13:34:45.228772,2026-06-08 13:34:45.431279,0 days 00:00:00.202507,gini,6,2,12,88,COMPLETE
31,0.9250362235949058,2026-06-08 13:34:45.431305,2026-06-08 13:34:45.625421,0 days 00:00:00.194116,entropy,7,3,9,100,COMPLETE
32,0.9286204529855868,2026-06-08 13:34:45.625445,2026-06-08 13:34:45.818661,0 days 00:00:00.193216,entropy,9,3,6,83,COMPLETE
33,0.9286204529855868,2026-06-08 13:34:45.818682,2026-06-08 13:34:46.013487,0 days 00:00:00.194805,entropy,9,3,6,93,COMPLETE
34,0.9285823228856859,2026-06-08 13:34:46.013508,2026-06-08 13:34:46.202702,0 days 00:00:00.189194,entropy,10,1,5,85,COMPLETE
35,0.9214901243041257,2026-06-08 13:34:46.202719,2026-06-08 13:34:46.397236,0 days 00:00:00.194517,log_loss,5,4,20,94,COMPLETE
36,0.9285823228856859,2026-06-08 13:34:46.397260,2026-06-08 13:34:46.591094,0 days 00:00:00.193834,entropy,7,2,7,89,COMPLETE
37,0.9214901243041257,2026-06-08 13:34:46.591117,2026-06-08 13:34:46.787688,0 days 00:00:00.196571,entropy,9,6,17,97,COMPLETE
38,0.9143597956226645,2026-06-08 13:34:46.787709,2026-06-08 13:34:46.930286,0 days 00:00:00.142577,entropy,4,3,10,51,COMPLETE
39,0.9215282544040265,2026-06-08 13:34:46.930308,2026-06-08 13:34:47.126636,0 days 00:00:00.196328,log_loss,5,5,4,86,COMPLETE
40,0.9071532067414018,2026-06-08 13:34:47.126657,2026-06-08 13:34:47.265181,0 days 00:00:00.138524,entropy,10,7,18,36,COMPLETE
41,0.9286204529855868,2026-06-08 13:34:47.265206,2026-06-08 13:34:47.458885,0 days 00:00:00.193679,entropy,9,3,5,91,COMPLETE
42,0.9286204529855868,2026-06-08 13:34:47.458905,2026-06-08 13:34:47.648279,0 days 00:00:00.189374,entropy,9,3,6,96,COMPLETE
43,0.9178677648135438,2026-06-08 13:34:47.648303,2026-06-08 13:34:47.854492,0 days 00:00:00.206189,entropy,3,4,6,80,COMPLETE
44,0.9285823228856859,2026-06-08 13:34:47.854517,2026-06-08 13:34:48.049172,0 days 00:00:00.194655,entropy,8,2,3,92,COMPLETE
45,0.9285823228856859,2026-06-08 13:34:48.049195,2026-06-08 13:34:48.241415,0 days 00:00:00.192220,entropy,7,1,7,100,COMPLETE
46,0.9250362235949058,2026-06-08 13:34:48.241435,2026-06-08 13:34:48.433313,0 days 00:00:00.191878,entropy,10,3,12,86,COMPLETE
47,0.9179440250133455,2026-06-08 13:34:48.433337,2026-06-08 13:34:48.630613,0 days 00:00:00.197276,gini,8,4,10,97,COMPLETE
48,0.9179058949134448,2026-06-08 13:34:48.630638,2026-06-08 13:34:48.833448,0 days 00:00:00.202810,log_loss,9,2,8,92,COMPLETE
49,0.924998093495005,2026-06-08 13:34:48.833469,2026-06-08 13:34:48.979026,0 days 00:00:00.145557,entropy,7,5,11,66,COMPLETE
50,0.9321665522763669,2026-06-08 13:34:48.979047,2026-06-08 13:34:49.170299,0 days 00:00:00.191252,entropy,8,3,7,77,COMPLETE
51,0.9321665522763669,2026-06-08 13:34:49.170324,2026-06-08 13:34:49.344508,0 days 00:00:00.174184,entropy,8,3,7,77,COMPLETE
52,0.9179440250133455,2026-06-08 13:34:49.344529,2026-06-08 13:34:49.535079,0 days 00:00:00.190550,entropy,8,2,9,76,COMPLETE
53,0.9179058949134448,2026-06-08 13:34:49.535103,2026-06-08 13:34:49.730217,0 days 00:00:00.195114,entropy,8,4,8,81,COMPLETE
54,0.9285823228856859,2026-06-08 13:34:49.730241,2026-06-08 13:34:49.872955,0 days 00:00:00.142714,entropy,7,3,7,60,COMPLETE
55,0.9321665522763669,2026-06-08 13:34:49.872977,2026-06-08 13:34:50.062086,0 days 00:00:00.189109,entropy,8,3,4,77,COMPLETE
56,0.9285823228856859,2026-06-08 13:34:50.062108,2026-06-08 13:34:50.206041,0 days 00:00:00.143933,entropy,8,2,2,56,COMPLETE
57,0.935750781667048,2026-06-08 13:34:50.206063,2026-06-08 13:34:50.355774,0 days 00:00:00.149711,entropy,6,4,4,70,COMPLETE
58,0.935750781667048,2026-06-08 13:34:50.355793,2026-06-08 13:34:50.502233,0 days 00:00:00.146440,entropy,6,4,3,70,COMPLETE
59,0.9214901243041257,2026-06-08 13:34:50.502254,2026-06-08 13:34:50.647759,0 days 00:00:00.145505,gini,6,4,3,70,COMPLETE
