number,value,datetime_start,datetime_complete,duration,params_criterion,params_max_depth,params_min_samples_leaf,params_min_samples_split,params_n_estimators,state
0,0.9543172471343949,2026-06-08 13:38:31.643768,2026-06-08 13:38:31.842827,0 days 00:00:00.199059,gini,10,1,4,44,COMPLETE
1,0.942954797883279,2026-06-08 13:38:31.842855,2026-06-08 13:38:32.120551,0 days 00:00:00.277696,log_loss,7,3,17,88,COMPLETE
2,0.8486375879474247,2026-06-08 13:38:32.120581,2026-06-08 13:38:32.279057,0 days 00:00:00.158476,entropy,4,7,7,26,COMPLETE
3,0.8886357838182009,2026-06-08 13:38:32.279092,2026-06-08 13:38:32.434669,0 days 00:00:00.155577,log_loss,5,6,5,22,COMPLETE
4,0.7329586510321201,2026-06-08 13:38:32.434705,2026-06-08 13:38:32.632378,0 days 00:00:00.197673,gini,3,10,20,63,COMPLETE
5,0.8961356295992507,2026-06-08 13:38:32.632407,2026-06-08 13:38:32.892614,0 days 00:00:00.260207,entropy,5,5,4,83,COMPLETE
6,0.9534091377595257,2026-06-08 13:38:32.892645,2026-06-08 13:38:33.034202,0 days 00:00:00.141557,entropy,10,6,11,13,COMPLETE
7,0.9484090339135997,2026-06-08 13:38:33.034240,2026-06-08 13:38:33.199672,0 days 00:00:00.165432,entropy,10,10,13,26,COMPLETE
8,0.8450020505695561,2026-06-08 13:38:33.199706,2026-06-08 13:38:33.351514,0 days 00:00:00.151808,log_loss,4,9,7,18,COMPLETE
9,0.8877262794980553,2026-06-08 13:38:33.351551,2026-06-08 13:38:33.553264,0 days 00:00:00.201713,log_loss,5,10,3,42,COMPLETE
10,0.9286367695795295,2026-06-08 13:38:33.553294,2026-06-08 13:38:33.753313,0 days 00:00:00.200019,gini,8,1,10,56,COMPLETE
11,0.948636409993636,2026-06-08 13:38:33.753335,2026-06-08 13:38:33.949924,0 days 00:00:00.196589,gini,10,4,12,41,COMPLETE
12,0.9311363565207337,2026-06-08 13:38:33.949961,2026-06-08 13:38:34.055424,0 days 00:00:00.105463,gini,9,1,15,11,COMPLETE
13,0.9506815547626065,2026-06-08 13:38:34.055456,2026-06-08 13:38:34.254165,0 days 00:00:00.198709,entropy,8,7,9,40,COMPLETE
14,0.9422729796310091,2026-06-08 13:38:34.254201,2026-06-08 13:38:34.492831,0 days 00:00:00.238630,gini,9,3,2,69,COMPLETE
15,0.9545463281475467,2026-06-08 13:38:34.492860,2026-06-08 13:38:34.755053,0 days 00:00:00.262193,entropy,10,8,7,74,COMPLETE
16,0.9059093911745842,2026-06-08 13:38:34.755085,2026-06-08 13:38:35.040397,0 days 00:00:00.285312,gini,7,8,6,100,COMPLETE
17,0.9525002534150585,2026-06-08 13:38:35.040427,2026-06-08 13:38:35.287292,0 days 00:00:00.246865,entropy,9,8,8,72,COMPLETE
18,0.9593181259499189,2026-06-08 13:38:35.287321,2026-06-08 13:38:35.490668,0 days 00:00:00.203347,entropy,8,2,5,50,COMPLETE
19,0.9602271652883058,2026-06-08 13:38:35.490698,2026-06-08 13:38:35.751224,0 days 00:00:00.260526,entropy,8,3,2,78,COMPLETE
20,0.9284093934994931,2026-06-08 13:38:35.751245,2026-06-08 13:38:35.946078,0 days 00:00:00.194833,entropy,6,3,2,53,COMPLETE
21,0.9586358427158902,2026-06-08 13:38:35.946109,2026-06-08 13:38:36.238622,0 days 00:00:00.292513,entropy,8,2,5,82,COMPLETE
22,0.9584089316176126,2026-06-08 13:38:36.238657,2026-06-08 13:38:36.531280,0 days 00:00:00.292623,entropy,8,2,5,85,COMPLETE
23,0.948409653889278,2026-06-08 13:38:36.531315,2026-06-08 13:38:36.837238,0 days 00:00:00.305923,entropy,7,2,2,96,COMPLETE
24,0.9570451401191532,2026-06-08 13:38:36.837271,2026-06-08 13:38:37.103372,0 days 00:00:00.266101,entropy,8,4,4,76,COMPLETE
25,0.930227317182347,2026-06-08 13:38:37.103402,2026-06-08 13:38:37.331777,0 days 00:00:00.228375,entropy,6,2,5,62,COMPLETE
26,0.9625004611069108,2026-06-08 13:38:37.331808,2026-06-08 13:38:37.627911,0 days 00:00:00.296103,entropy,9,4,9,90,COMPLETE
27,0.9615911117806849,2026-06-08 13:38:37.627943,2026-06-08 13:38:37.916629,0 days 00:00:00.288686,entropy,9,4,10,93,COMPLETE
28,0.9584098615811302,2026-06-08 13:38:37.916672,2026-06-08 13:38:38.223959,0 days 00:00:00.307287,entropy,9,4,15,92,COMPLETE
29,0.9622721550633568,2026-06-08 13:38:38.223982,2026-06-08 13:38:38.521715,0 days 00:00:00.297733,entropy,9,4,14,92,COMPLETE
30,0.9597724131282329,2026-06-08 13:38:38.521744,2026-06-08 13:38:38.818399,0 days 00:00:00.296655,log_loss,9,5,14,90,COMPLETE
31,0.9577275783471014,2026-06-08 13:38:38.818430,2026-06-08 13:38:39.131613,0 days 00:00:00.313183,entropy,9,4,17,98,COMPLETE
32,0.9595459670117141,2026-06-08 13:38:39.131641,2026-06-08 13:38:39.398565,0 days 00:00:00.266924,entropy,9,5,10,79,COMPLETE
33,0.9429551078711182,2026-06-08 13:38:39.398592,2026-06-08 13:38:39.702368,0 days 00:00:00.303776,entropy,7,3,17,93,COMPLETE
34,0.9636367215314143,2026-06-08 13:38:39.702391,2026-06-08 13:38:39.998321,0 days 00:00:00.295930,entropy,10,4,12,86,COMPLETE
35,0.9643180748019256,2026-06-08 13:38:39.998345,2026-06-08 13:38:40.277952,0 days 00:00:00.279607,entropy,10,5,11,88,COMPLETE
36,0.9609094485223345,2026-06-08 13:38:40.277984,2026-06-08 13:38:40.567227,0 days 00:00:00.289243,log_loss,10,6,12,87,COMPLETE
37,0.9618186428546408,2026-06-08 13:38:40.567257,2026-06-08 13:38:40.812840,0 days 00:00:00.245583,entropy,10,5,12,67,COMPLETE
38,0.9552272164362993,2026-06-08 13:38:40.812867,2026-06-08 13:38:41.109866,0 days 00:00:00.296999,entropy,10,6,19,87,COMPLETE
39,0.9602276302700644,2026-06-08 13:38:41.109900,2026-06-08 13:38:41.399154,0 days 00:00:00.289254,entropy,10,5,14,83,COMPLETE
40,0.9590916798334002,2026-06-08 13:38:41.399187,2026-06-08 13:38:41.723722,0 days 00:00:00.324535,log_loss,10,7,11,100,COMPLETE
41,0.9618186428546408,2026-06-08 13:38:41.723746,2026-06-08 13:38:41.962824,0 days 00:00:00.239078,entropy,10,5,12,67,COMPLETE
42,0.96113713459021,2026-06-08 13:38:41.962852,2026-06-08 13:38:42.246058,0 days 00:00:00.283206,entropy,10,4,13,80,COMPLETE
43,0.9547732392458244,2026-06-08 13:38:42.246090,2026-06-08 13:38:42.424501,0 days 00:00:00.178411,entropy,9,5,9,35,COMPLETE
44,0.963863632629692,2026-06-08 13:38:42.424527,2026-06-08 13:38:42.670963,0 days 00:00:00.246436,entropy,10,4,11,61,COMPLETE
45,0.9650002030420346,2026-06-08 13:38:42.670997,2026-06-08 13:38:42.967389,0 days 00:00:00.296392,entropy,10,4,11,89,COMPLETE
46,0.9595458120177945,2026-06-08 13:38:42.967418,2026-06-08 13:38:43.182101,0 days 00:00:00.214683,entropy,10,6,9,61,COMPLETE
47,0.7411407800471989,2026-06-08 13:38:43.182124,2026-06-08 13:38:43.437263,0 days 00:00:00.255139,gini,3,3,11,88,COMPLETE
48,0.961363890694568,2026-06-08 13:38:43.437288,2026-06-08 13:38:43.642644,0 days 00:00:00.205356,log_loss,10,4,8,47,COMPLETE
49,0.9588633737898462,2026-06-08 13:38:43.642667,2026-06-08 13:38:43.822870,0 days 00:00:00.180203,entropy,10,3,13,33,COMPLETE
50,0.9615915767624436,2026-06-08 13:38:43.822901,2026-06-08 13:38:44.130290,0 days 00:00:00.307389,entropy,9,5,10,96,COMPLETE
51,0.9613640456884877,2026-06-08 13:38:44.130322,2026-06-08 13:38:44.427867,0 days 00:00:00.297545,entropy,9,4,11,90,COMPLETE
52,0.8588639317679568,2026-06-08 13:38:44.427894,2026-06-08 13:38:44.665025,0 days 00:00:00.237131,entropy,4,4,15,72,COMPLETE
53,0.9631821243652611,2026-06-08 13:38:44.665057,2026-06-08 13:38:44.963369,0 days 00:00:00.298312,entropy,10,3,14,84,COMPLETE
54,0.9643185397836843,2026-06-08 13:38:44.963401,2026-06-08 13:38:45.262896,0 days 00:00:00.299495,entropy,10,3,11,84,COMPLETE
55,0.9536369788213209,2026-06-08 13:38:45.262923,2026-06-08 13:38:45.540427,0 days 00:00:00.277504,gini,10,3,11,84,COMPLETE
56,0.9640913186975674,2026-06-08 13:38:45.540454,2026-06-08 13:38:45.805858,0 days 00:00:00.265404,entropy,10,3,13,76,COMPLETE
57,0.9649995830663564,2026-06-08 13:38:45.805890,2026-06-08 13:38:46.065726,0 days 00:00:00.259836,entropy,10,1,13,75,COMPLETE
58,0.9649995830663564,2026-06-08 13:38:46.065754,2026-06-08 13:38:46.320389,0 days 00:00:00.254635,entropy,10,1,13,75,COMPLETE
59,0.9649998930541955,2026-06-08 13:38:46.320417,2026-06-08 13:38:46.590024,0 days 00:00:00.269607,entropy,10,1,13,76,COMPLETE
