number,value,datetime_start,datetime_complete,duration,params_criterion,params_max_depth,params_min_samples_leaf,params_min_samples_split,params_n_estimators,state
0,0.7682379349046015,2026-06-08 13:33:50.383332,2026-06-08 13:33:50.520471,0 days 00:00:00.137139,gini,10,1,4,44,COMPLETE
1,0.7199775533108866,2026-06-08 13:33:50.520495,2026-06-08 13:33:50.714811,0 days 00:00:00.194316,log_loss,7,3,17,88,COMPLETE
2,0.6894500561167227,2026-06-08 13:33:50.714836,2026-06-08 13:33:50.807457,0 days 00:00:00.092621,entropy,4,7,7,26,COMPLETE
3,0.7136924803591471,2026-06-08 13:33:50.807481,2026-06-08 13:33:50.901064,0 days 00:00:00.093583,log_loss,5,6,5,22,COMPLETE
4,0.68327721661055,2026-06-08 13:33:50.901087,2026-06-08 13:33:51.049044,0 days 00:00:00.147957,gini,3,10,20,63,COMPLETE
5,0.7077441077441078,2026-06-08 13:33:51.049066,2026-06-08 13:33:51.242592,0 days 00:00:00.193526,entropy,5,5,4,83,COMPLETE
6,0.6769921436588103,2026-06-08 13:33:51.242614,2026-06-08 13:33:51.328093,0 days 00:00:00.085479,entropy,10,6,11,13,COMPLETE
7,0.6712682379349045,2026-06-08 13:33:51.328119,2026-06-08 13:33:51.422945,0 days 00:00:00.094826,entropy,10,10,13,26,COMPLETE
8,0.6835016835016835,2026-06-08 13:33:51.422966,2026-06-08 13:33:51.515191,0 days 00:00:00.092225,log_loss,4,9,7,18,COMPLETE
9,0.6894500561167227,2026-06-08 13:33:51.515213,2026-06-08 13:33:51.655184,0 days 00:00:00.139971,log_loss,5,10,3,42,COMPLETE
10,0.7319865319865321,2026-06-08 13:33:51.655212,2026-06-08 13:33:51.800957,0 days 00:00:00.145745,gini,8,1,10,56,COMPLETE
11,0.756341189674523,2026-06-08 13:33:51.800978,2026-06-08 13:33:51.947247,0 days 00:00:00.146269,gini,8,1,11,56,COMPLETE
12,0.7320987654320987,2026-06-08 13:33:51.947271,2026-06-08 13:33:52.088760,0 days 00:00:00.141489,gini,8,1,15,41,COMPLETE
13,0.7685746352413019,2026-06-08 13:33:52.088782,2026-06-08 13:33:52.249420,0 days 00:00:00.160638,gini,9,3,8,70,COMPLETE
14,0.7806958473625141,2026-06-08 13:33:52.249441,2026-06-08 13:33:52.397771,0 days 00:00:00.148330,gini,9,3,2,72,COMPLETE
15,0.7503928170594838,2026-06-08 13:33:52.397789,2026-06-08 13:33:52.546441,0 days 00:00:00.148652,gini,9,3,8,74,COMPLETE
16,0.762401795735129,2026-06-08 13:33:52.546462,2026-06-08 13:33:52.743587,0 days 00:00:00.197125,gini,7,3,8,100,COMPLETE
17,0.7381593714927049,2026-06-08 13:33:52.743610,2026-06-08 13:33:52.890218,0 days 00:00:00.146608,gini,9,4,2,72,COMPLETE
18,0.7381593714927049,2026-06-08 13:33:52.890239,2026-06-08 13:33:53.035922,0 days 00:00:00.145683,gini,9,4,6,68,COMPLETE
19,0.7683501683501683,2026-06-08 13:33:53.035943,2026-06-08 13:33:53.229602,0 days 00:00:00.193659,gini,6,2,2,84,COMPLETE
20,0.6893378226711558,2026-06-08 13:33:53.229624,2026-06-08 13:33:53.425390,0 days 00:00:00.195766,gini,9,8,9,99,COMPLETE
21,0.7683501683501683,2026-06-08 13:33:53.425410,2026-06-08 13:33:53.612360,0 days 00:00:00.186950,gini,6,2,2,85,COMPLETE
22,0.7622895622895624,2026-06-08 13:33:53.612381,2026-06-08 13:33:53.816648,0 days 00:00:00.204267,gini,6,2,5,80,COMPLETE
23,0.7442199775533109,2026-06-08 13:33:53.816673,2026-06-08 13:33:54.018375,0 days 00:00:00.201702,gini,7,4,2,91,COMPLETE
24,0.7077441077441078,2026-06-08 13:33:54.018414,2026-06-08 13:33:54.170008,0 days 00:00:00.151594,gini,8,5,14,63,COMPLETE
25,0.7683501683501683,2026-06-08 13:33:54.170032,2026-06-08 13:33:54.346142,0 days 00:00:00.176110,gini,6,2,4,77,COMPLETE
26,0.7806958473625141,2026-06-08 13:33:54.346165,2026-06-08 13:33:54.538369,0 days 00:00:00.192204,gini,7,3,6,92,COMPLETE
27,0.7746352413019081,2026-06-08 13:33:54.538391,2026-06-08 13:33:54.738457,0 days 00:00:00.200066,gini,9,3,6,93,COMPLETE
28,0.7442199775533109,2026-06-08 13:33:54.738476,2026-06-08 13:33:54.942751,0 days 00:00:00.204275,log_loss,8,4,6,94,COMPLETE
29,0.7499438832772167,2026-06-08 13:33:54.942774,2026-06-08 13:33:55.136737,0 days 00:00:00.193963,entropy,10,3,4,92,COMPLETE
30,0.7015712682379349,2026-06-08 13:33:55.136755,2026-06-08 13:33:55.279217,0 days 00:00:00.142462,gini,10,5,6,51,COMPLETE
31,0.7746352413019081,2026-06-08 13:33:55.279240,2026-06-08 13:33:55.425952,0 days 00:00:00.146712,gini,9,3,8,69,COMPLETE
32,0.7383838383838385,2026-06-08 13:33:55.425973,2026-06-08 13:33:55.616256,0 days 00:00:00.190283,gini,9,4,10,80,COMPLETE
33,0.7683501683501683,2026-06-08 13:33:55.616280,2026-06-08 13:33:55.766834,0 days 00:00:00.150554,gini,7,2,5,65,COMPLETE
34,0.7806958473625141,2026-06-08 13:33:55.766856,2026-06-08 13:33:55.960139,0 days 00:00:00.193283,gini,8,3,7,95,COMPLETE
35,0.6894500561167227,2026-06-08 13:33:55.960160,2026-06-08 13:33:56.154224,0 days 00:00:00.194064,log_loss,8,6,7,95,COMPLETE
36,0.7017957351290685,2026-06-08 13:33:56.154246,2026-06-08 13:33:56.345716,0 days 00:00:00.191470,gini,7,7,3,89,COMPLETE
37,0.7078563411896744,2026-06-08 13:33:56.345737,2026-06-08 13:33:56.536968,0 days 00:00:00.191231,entropy,7,5,12,87,COMPLETE
38,0.7138047138047138,2026-06-08 13:33:56.536995,2026-06-08 13:33:56.734404,0 days 00:00:00.197409,gini,8,3,18,100,COMPLETE
39,0.7684624017957352,2026-06-08 13:33:56.734424,2026-06-08 13:33:56.831329,0 days 00:00:00.096905,entropy,10,2,5,34,COMPLETE
40,0.6895622895622896,2026-06-08 13:33:56.831351,2026-06-08 13:33:57.028343,0 days 00:00:00.196992,log_loss,3,4,9,95,COMPLETE
41,0.7868686868686869,2026-06-08 13:33:57.028362,2026-06-08 13:33:57.203390,0 days 00:00:00.175028,gini,9,3,7,76,COMPLETE
42,0.7746352413019081,2026-06-08 13:33:57.203412,2026-06-08 13:33:57.381473,0 days 00:00:00.178061,gini,9,3,7,77,COMPLETE
43,0.7742985409652077,2026-06-08 13:33:57.381491,2026-06-08 13:33:57.570526,0 days 00:00:00.189035,gini,10,1,6,88,COMPLETE
44,0.7746352413019081,2026-06-08 13:33:57.570547,2026-06-08 13:33:57.761462,0 days 00:00:00.190915,gini,8,3,3,81,COMPLETE
45,0.7382716049382716,2026-06-08 13:33:57.761484,2026-06-08 13:33:57.935859,0 days 00:00:00.174375,gini,8,4,10,76,COMPLETE
46,0.7683501683501683,2026-06-08 13:33:57.935882,2026-06-08 13:33:58.078509,0 days 00:00:00.142627,gini,9,2,4,62,COMPLETE
47,0.7139169472502805,2026-06-08 13:33:58.078527,2026-06-08 13:33:58.284898,0 days 00:00:00.206371,entropy,10,5,9,96,COMPLETE
48,0.7684624017957352,2026-06-08 13:33:58.284922,2026-06-08 13:33:58.429989,0 days 00:00:00.145067,gini,8,1,7,59,COMPLETE
49,0.6833894500561168,2026-06-08 13:33:58.430011,2026-06-08 13:33:58.575474,0 days 00:00:00.145463,log_loss,9,7,5,52,COMPLETE
50,0.7381593714927049,2026-06-08 13:33:58.575499,2026-06-08 13:33:58.768916,0 days 00:00:00.193417,gini,7,3,12,85,COMPLETE
51,0.7685746352413019,2026-06-08 13:33:58.768938,2026-06-08 13:33:58.914231,0 days 00:00:00.145293,gini,9,3,8,70,COMPLETE
52,0.7929292929292929,2026-06-08 13:33:58.914248,2026-06-08 13:33:59.064488,0 days 00:00:00.150240,gini,9,3,7,67,COMPLETE
53,0.7381593714927049,2026-06-08 13:33:59.064509,2026-06-08 13:33:59.257736,0 days 00:00:00.193227,gini,9,4,6,91,COMPLETE
54,0.7804713804713805,2026-06-08 13:33:59.257757,2026-06-08 13:33:59.411187,0 days 00:00:00.153430,gini,8,2,3,73,COMPLETE
55,0.7804713804713805,2026-06-08 13:33:59.411206,2026-06-08 13:33:59.581387,0 days 00:00:00.170181,gini,8,2,3,73,COMPLETE
56,0.7560044893378226,2026-06-08 13:33:59.581411,2026-06-08 13:33:59.728643,0 days 00:00:00.147232,gini,8,1,4,66,COMPLETE
57,0.7865319865319865,2026-06-08 13:33:59.728661,2026-06-08 13:33:59.874200,0 days 00:00:00.145539,gini,7,2,3,60,COMPLETE
58,0.7562289562289563,2026-06-08 13:33:59.874225,2026-06-08 13:34:00.017490,0 days 00:00:00.143265,gini,5,2,5,47,COMPLETE
59,0.7625140291806959,2026-06-08 13:34:00.017515,2026-06-08 13:34:00.163160,0 days 00:00:00.145645,gini,7,4,2,61,COMPLETE
