number,value,datetime_start,datetime_complete,duration,params_criterion,params_max_depth,params_min_samples_leaf,params_min_samples_split,params_n_estimators,state
0,0.7282608695652174,2026-06-08 13:32:49.680164,2026-06-08 13:32:49.820104,0 days 00:00:00.139940,gini,10,1,4,44,COMPLETE
1,0.717391304347826,2026-06-08 13:32:49.820127,2026-06-08 13:32:50.009940,0 days 00:00:00.189813,log_loss,7,3,17,88,COMPLETE
2,0.6992753623188407,2026-06-08 13:32:50.009959,2026-06-08 13:32:50.102427,0 days 00:00:00.092468,entropy,4,7,7,26,COMPLETE
3,0.7173913043478262,2026-06-08 13:32:50.102450,2026-06-08 13:32:50.193909,0 days 00:00:00.091459,log_loss,5,6,5,22,COMPLETE
4,0.7246376811594203,2026-06-08 13:32:50.193930,2026-06-08 13:32:50.340001,0 days 00:00:00.146071,gini,3,10,20,63,COMPLETE
5,0.7282608695652174,2026-06-08 13:32:50.340023,2026-06-08 13:32:50.531050,0 days 00:00:00.191027,entropy,5,5,4,83,COMPLETE
6,0.6847826086956522,2026-06-08 13:32:50.531074,2026-06-08 13:32:50.620335,0 days 00:00:00.089261,entropy,10,6,11,13,COMPLETE
7,0.6920289855072465,2026-06-08 13:32:50.620360,2026-06-08 13:32:50.714652,0 days 00:00:00.094292,entropy,10,10,13,26,COMPLETE
8,0.7137681159420289,2026-06-08 13:32:50.714674,2026-06-08 13:32:50.804740,0 days 00:00:00.090066,log_loss,4,9,7,18,COMPLETE
9,0.7028985507246377,2026-06-08 13:32:50.804766,2026-06-08 13:32:50.959119,0 days 00:00:00.154353,log_loss,5,10,3,42,COMPLETE
10,0.7246376811594203,2026-06-08 13:32:50.959147,2026-06-08 13:32:51.102390,0 days 00:00:00.143243,gini,8,1,10,56,COMPLETE
11,0.7391304347826088,2026-06-08 13:32:51.102411,2026-06-08 13:32:51.302139,0 days 00:00:00.199728,gini,7,3,2,92,COMPLETE
12,0.7391304347826088,2026-06-08 13:32:51.302162,2026-06-08 13:32:51.499141,0 days 00:00:00.196979,gini,8,1,2,100,COMPLETE
13,0.75,2026-06-08 13:32:51.499162,2026-06-08 13:32:51.694403,0 days 00:00:00.195241,gini,8,3,2,98,COMPLETE
14,0.7282608695652174,2026-06-08 13:32:51.694426,2026-06-08 13:32:51.870165,0 days 00:00:00.175739,gini,8,3,7,75,COMPLETE
15,0.7391304347826088,2026-06-08 13:32:51.870186,2026-06-08 13:32:52.064186,0 days 00:00:00.194000,gini,7,3,14,100,COMPLETE
16,0.7391304347826088,2026-06-08 13:32:52.064208,2026-06-08 13:32:52.251418,0 days 00:00:00.187210,gini,9,4,2,75,COMPLETE
17,0.7355072463768115,2026-06-08 13:32:52.251442,2026-06-08 13:32:52.451855,0 days 00:00:00.200413,gini,6,2,9,89,COMPLETE
18,0.7355072463768115,2026-06-08 13:32:52.451875,2026-06-08 13:32:52.608373,0 days 00:00:00.156498,gini,6,4,6,69,COMPLETE
19,0.717391304347826,2026-06-08 13:32:52.608395,2026-06-08 13:32:52.808427,0 days 00:00:00.200032,gini,9,8,9,93,COMPLETE
20,0.7318840579710145,2026-06-08 13:32:52.808447,2026-06-08 13:32:53.000844,0 days 00:00:00.192397,gini,7,5,13,80,COMPLETE
21,0.7427536231884058,2026-06-08 13:32:53.000869,2026-06-08 13:32:53.196435,0 days 00:00:00.195566,gini,8,2,2,95,COMPLETE
22,0.746376811594203,2026-06-08 13:32:53.196457,2026-06-08 13:32:53.399637,0 days 00:00:00.203180,gini,9,2,2,93,COMPLETE
23,0.7427536231884059,2026-06-08 13:32:53.399658,2026-06-08 13:32:53.587403,0 days 00:00:00.187745,gini,9,2,4,98,COMPLETE
24,0.7246376811594203,2026-06-08 13:32:53.587427,2026-06-08 13:32:53.776979,0 days 00:00:00.189552,gini,9,2,5,81,COMPLETE
25,0.7391304347826088,2026-06-08 13:32:53.777000,2026-06-08 13:32:53.973305,0 days 00:00:00.196305,gini,9,4,4,86,COMPLETE
26,0.7391304347826088,2026-06-08 13:32:53.973328,2026-06-08 13:32:54.166348,0 days 00:00:00.193020,gini,9,2,5,99,COMPLETE
27,0.746376811594203,2026-06-08 13:32:54.166369,2026-06-08 13:32:54.312856,0 days 00:00:00.146487,gini,8,1,3,68,COMPLETE
28,0.7173913043478262,2026-06-08 13:32:54.312877,2026-06-08 13:32:54.457007,0 days 00:00:00.144130,log_loss,8,1,3,64,COMPLETE
29,0.7282608695652174,2026-06-08 13:32:54.457042,2026-06-08 13:32:54.600370,0 days 00:00:00.143328,entropy,10,1,8,46,COMPLETE
30,0.7355072463768115,2026-06-08 13:32:54.600397,2026-06-08 13:32:54.739843,0 days 00:00:00.139446,gini,8,4,3,38,COMPLETE
31,0.7318840579710143,2026-06-08 13:32:54.739868,2026-06-08 13:32:54.926829,0 days 00:00:00.186961,gini,9,2,4,73,COMPLETE
32,0.7427536231884058,2026-06-08 13:32:54.926851,2026-06-08 13:32:55.143041,0 days 00:00:00.216190,gini,10,3,6,92,COMPLETE
33,0.7282608695652174,2026-06-08 13:32:55.143067,2026-06-08 13:32:55.339245,0 days 00:00:00.196178,gini,9,1,3,86,COMPLETE
34,0.7246376811594203,2026-06-08 13:32:55.339266,2026-06-08 13:32:55.485203,0 days 00:00:00.145937,gini,7,2,4,53,COMPLETE
35,0.7246376811594203,2026-06-08 13:32:55.485228,2026-06-08 13:32:55.678451,0 days 00:00:00.193223,log_loss,8,1,17,94,COMPLETE
36,0.75,2026-06-08 13:32:55.678474,2026-06-08 13:32:55.859569,0 days 00:00:00.181095,gini,10,3,6,79,COMPLETE
37,0.7427536231884058,2026-06-08 13:32:55.859592,2026-06-08 13:32:56.006022,0 days 00:00:00.146430,entropy,10,5,6,67,COMPLETE
38,0.7391304347826088,2026-06-08 13:32:56.006041,2026-06-08 13:32:56.150633,0 days 00:00:00.144592,gini,10,3,5,59,COMPLETE
39,0.7282608695652174,2026-06-08 13:32:56.150653,2026-06-08 13:32:56.339469,0 days 00:00:00.188816,entropy,10,6,2,78,COMPLETE
40,0.7210144927536232,2026-06-08 13:32:56.339493,2026-06-08 13:32:56.536855,0 days 00:00:00.197362,log_loss,6,7,20,84,COMPLETE
41,0.7427536231884059,2026-06-08 13:32:56.536882,2026-06-08 13:32:56.726443,0 days 00:00:00.189561,gini,9,2,3,89,COMPLETE
42,0.746376811594203,2026-06-08 13:32:56.726463,2026-06-08 13:32:56.913407,0 days 00:00:00.186944,gini,9,3,4,96,COMPLETE
43,0.7318840579710146,2026-06-08 13:32:56.913429,2026-06-08 13:32:57.061755,0 days 00:00:00.148326,gini,10,3,7,71,COMPLETE
44,0.7355072463768115,2026-06-08 13:32:57.061773,2026-06-08 13:32:57.251310,0 days 00:00:00.189537,gini,8,4,3,78,COMPLETE
45,0.7427536231884058,2026-06-08 13:32:57.251330,2026-06-08 13:32:57.436453,0 days 00:00:00.185123,gini,9,3,5,89,COMPLETE
46,0.7210144927536231,2026-06-08 13:32:57.436475,2026-06-08 13:32:57.632769,0 days 00:00:00.196294,gini,7,1,2,95,COMPLETE
47,0.7101449275362318,2026-06-08 13:32:57.632791,2026-06-08 13:32:57.827471,0 days 00:00:00.194680,entropy,3,3,6,83,COMPLETE
48,0.7246376811594203,2026-06-08 13:32:57.827495,2026-06-08 13:32:57.972872,0 days 00:00:00.145377,gini,8,5,3,65,COMPLETE
49,0.7427536231884059,2026-06-08 13:32:57.972894,2026-06-08 13:32:58.116579,0 days 00:00:00.143685,log_loss,10,4,4,60,COMPLETE
50,0.7282608695652174,2026-06-08 13:32:58.116598,2026-06-08 13:32:58.315135,0 days 00:00:00.198537,gini,8,2,11,90,COMPLETE
51,0.746376811594203,2026-06-08 13:32:58.315156,2026-06-08 13:32:58.511164,0 days 00:00:00.196008,gini,9,2,4,97,COMPLETE
52,0.7391304347826088,2026-06-08 13:32:58.511188,2026-06-08 13:32:58.705829,0 days 00:00:00.194641,gini,9,1,5,97,COMPLETE
53,0.746376811594203,2026-06-08 13:32:58.705855,2026-06-08 13:32:58.907004,0 days 00:00:00.201149,gini,9,3,2,86,COMPLETE
54,0.7391304347826088,2026-06-08 13:32:58.907026,2026-06-08 13:32:59.096663,0 days 00:00:00.189637,gini,9,2,8,96,COMPLETE
55,0.7355072463768116,2026-06-08 13:32:59.096687,2026-06-08 13:32:59.293512,0 days 00:00:00.196825,gini,8,2,4,100,COMPLETE
56,0.7427536231884058,2026-06-08 13:32:59.293538,2026-06-08 13:32:59.488724,0 days 00:00:00.195186,gini,10,3,2,92,COMPLETE
57,0.7355072463768115,2026-06-08 13:32:59.488744,2026-06-08 13:32:59.661970,0 days 00:00:00.173226,gini,7,4,3,76,COMPLETE
58,0.7282608695652174,2026-06-08 13:32:59.661996,2026-06-08 13:32:59.857973,0 days 00:00:00.195977,gini,9,1,15,84,COMPLETE
59,0.7427536231884058,2026-06-08 13:32:59.857996,2026-06-08 13:33:00.053953,0 days 00:00:00.195957,gini,10,2,7,91,COMPLETE
