number,value,datetime_start,datetime_complete,duration,params_criterion,params_max_depth,params_min_samples_leaf,params_min_samples_split,params_n_estimators,state
0,0.9412542483246785,2026-06-08 13:34:59.301575,2026-06-08 13:34:59.472795,0 days 00:00:00.171220,gini,10,1,4,44,COMPLETE
1,0.9368776833835754,2026-06-08 13:34:59.472822,2026-06-08 13:34:59.720927,0 days 00:00:00.248105,log_loss,7,3,17,88,COMPLETE
2,0.886258499577217,2026-06-08 13:34:59.720958,2026-06-08 13:34:59.854626,0 days 00:00:00.133668,entropy,4,7,7,26,COMPLETE
3,0.9056303916539598,2026-06-08 13:34:59.854659,2026-06-08 13:34:59.984770,0 days 00:00:00.130111,log_loss,5,6,5,22,COMPLETE
4,0.8843858404011872,2026-06-08 13:34:59.984808,2026-06-08 13:35:00.182801,0 days 00:00:00.197993,gini,3,10,20,63,COMPLETE
5,0.9256370437515957,2026-06-08 13:35:00.182833,2026-06-08 13:35:00.404382,0 days 00:00:00.221549,entropy,5,5,4,83,COMPLETE
6,0.9112612517654995,2026-06-08 13:35:00.404410,2026-06-08 13:35:00.494647,0 days 00:00:00.090237,entropy,10,6,11,13,COMPLETE
7,0.9143858638240662,2026-06-08 13:35:00.494679,2026-06-08 13:35:00.624107,0 days 00:00:00.129428,entropy,10,10,13,26,COMPLETE
8,0.8812623994865705,2026-06-08 13:35:00.624137,2026-06-08 13:35:00.741604,0 days 00:00:00.117467,log_loss,4,9,7,18,COMPLETE
9,0.9193843062026126,2026-06-08 13:35:00.741637,2026-06-08 13:35:00.880967,0 days 00:00:00.139330,log_loss,5,10,3,42,COMPLETE
10,0.9393886160123485,2026-06-08 13:35:00.880988,2026-06-08 13:35:01.064588,0 days 00:00:00.183600,gini,8,1,10,56,COMPLETE
11,0.9375089299726187,2026-06-08 13:35:01.064620,2026-06-08 13:35:01.252283,0 days 00:00:00.187663,gini,8,1,11,56,COMPLETE
12,0.9343819756261521,2026-06-08 13:35:01.252310,2026-06-08 13:35:01.400565,0 days 00:00:00.148255,gini,8,1,8,41,COMPLETE
13,0.9468780815725184,2026-06-08 13:35:01.400588,2026-06-08 13:35:01.615789,0 days 00:00:00.215201,gini,9,3,2,70,COMPLETE
14,0.9456296421218319,2026-06-08 13:35:01.615818,2026-06-08 13:35:01.816154,0 days 00:00:00.200336,gini,9,3,2,72,COMPLETE
15,0.946256204135075,2026-06-08 13:35:01.816176,2026-06-08 13:35:02.039333,0 days 00:00:00.223157,gini,9,3,3,74,COMPLETE
16,0.936259319377982,2026-06-08 13:35:02.039364,2026-06-08 13:35:02.307383,0 days 00:00:00.268019,gini,7,3,14,100,COMPLETE
17,0.9437604963776517,2026-06-08 13:35:02.307414,2026-06-08 13:35:02.526253,0 days 00:00:00.218839,gini,9,4,2,74,COMPLETE
18,0.9456343266976317,2026-06-08 13:35:02.526282,2026-06-08 13:35:02.742419,0 days 00:00:00.216137,gini,9,4,6,71,COMPLETE
19,0.9350108799272953,2026-06-08 13:35:02.742449,2026-06-08 13:35:02.962896,0 days 00:00:00.220447,gini,6,2,9,88,COMPLETE
20,0.936256977090082,2026-06-08 13:35:02.962924,2026-06-08 13:35:03.231702,0 days 00:00:00.268778,gini,9,8,5,99,COMPLETE
21,0.9443858872469452,2026-06-08 13:35:03.231735,2026-06-08 13:35:03.451058,0 days 00:00:00.219323,gini,9,4,6,68,COMPLETE
22,0.938131978554012,2026-06-08 13:35:03.451087,2026-06-08 13:35:03.671555,0 days 00:00:00.220468,gini,8,4,2,77,COMPLETE
23,0.938133149697962,2026-06-08 13:35:03.671586,2026-06-08 13:35:03.852789,0 days 00:00:00.181203,gini,10,5,4,63,COMPLETE
24,0.9337600981887088,2026-06-08 13:35:03.852819,2026-06-08 13:35:04.067947,0 days 00:00:00.215128,gini,7,2,5,83,COMPLETE
25,0.940003466586092,2026-06-08 13:35:04.067978,2026-06-08 13:35:04.245779,0 days 00:00:00.177801,gini,9,2,7,49,COMPLETE
26,0.9368858813912254,2026-06-08 13:35:04.245807,2026-06-08 13:35:04.423539,0 days 00:00:00.177732,gini,8,4,3,65,COMPLETE
27,0.9300112664047989,2026-06-08 13:35:04.423570,2026-06-08 13:35:04.640935,0 days 00:00:00.217365,gini,6,3,6,80,COMPLETE
28,0.9431280786446585,2026-06-08 13:35:04.640968,2026-06-08 13:35:04.861122,0 days 00:00:00.220154,log_loss,9,5,13,70,COMPLETE
29,0.950003864775035,2026-06-08 13:35:04.861155,2026-06-08 13:35:05.119291,0 days 00:00:00.258136,entropy,10,2,4,92,COMPLETE
30,0.9493784739057416,2026-06-08 13:35:05.119322,2026-06-08 13:35:05.385847,0 days 00:00:00.266525,entropy,10,2,3,95,COMPLETE
31,0.9493784739057416,2026-06-08 13:35:05.385882,2026-06-08 13:35:05.651176,0 days 00:00:00.265294,entropy,10,2,3,93,COMPLETE
32,0.9493784739057416,2026-06-08 13:35:05.651210,2026-06-08 13:35:05.920300,0 days 00:00:00.269090,entropy,10,2,4,93,COMPLETE
33,0.9493784739057416,2026-06-08 13:35:05.920333,2026-06-08 13:35:06.188659,0 days 00:00:00.268326,entropy,10,2,4,93,COMPLETE
34,0.948128863311105,2026-06-08 13:35:06.188691,2026-06-08 13:35:06.454539,0 days 00:00:00.265848,entropy,10,1,4,92,COMPLETE
35,0.9425073723511651,2026-06-08 13:35:06.454574,2026-06-08 13:35:06.733679,0 days 00:00:00.279105,entropy,10,2,17,92,COMPLETE
36,0.9512581599454716,2026-06-08 13:35:06.733710,2026-06-08 13:35:06.998848,0 days 00:00:00.265138,entropy,10,2,5,96,COMPLETE
37,0.9493784739057416,2026-06-08 13:35:06.998880,2026-06-08 13:35:07.262362,0 days 00:00:00.263482,entropy,10,1,8,89,COMPLETE
38,0.9437593252337018,2026-06-08 13:35:07.262389,2026-06-08 13:35:07.487630,0 days 00:00:00.225241,entropy,10,7,5,85,COMPLETE
39,0.9493773027617917,2026-06-08 13:35:07.487652,2026-06-08 13:35:07.752412,0 days 00:00:00.264760,entropy,10,2,3,97,COMPLETE
40,0.8931284299878435,2026-06-08 13:35:07.752433,2026-06-08 13:35:08.017090,0 days 00:00:00.264657,entropy,3,3,20,97,COMPLETE
41,0.9493784739057416,2026-06-08 13:35:08.017118,2026-06-08 13:35:08.282945,0 days 00:00:00.265827,entropy,10,2,4,93,COMPLETE
42,0.9487612810440984,2026-06-08 13:35:08.282981,2026-06-08 13:35:08.547298,0 days 00:00:00.264317,entropy,10,1,5,86,COMPLETE
43,0.9493808161936416,2026-06-08 13:35:08.547324,2026-06-08 13:35:08.776080,0 days 00:00:00.228756,entropy,10,2,3,79,COMPLETE
44,0.9468815950043683,2026-06-08 13:35:08.776111,2026-06-08 13:35:09.003300,0 days 00:00:00.227189,entropy,10,1,3,80,COMPLETE
45,0.9375007319649686,2026-06-08 13:35:09.003332,2026-06-08 13:35:09.140510,0 days 00:00:00.137178,entropy,9,3,2,33,COMPLETE
46,0.9462597175669251,2026-06-08 13:35:09.140540,2026-06-08 13:35:09.413096,0 days 00:00:00.272556,entropy,10,2,6,96,COMPLETE
47,0.9400128357376918,2026-06-08 13:35:09.413121,2026-06-08 13:35:09.635854,0 days 00:00:00.222733,entropy,8,1,7,79,COMPLETE
48,0.9493819873375916,2026-06-08 13:35:09.635883,2026-06-08 13:35:09.906255,0 days 00:00:00.270372,log_loss,9,3,3,89,COMPLETE
49,0.9331323650315154,2026-06-08 13:35:09.906285,2026-06-08 13:35:10.170704,0 days 00:00:00.264419,log_loss,9,3,18,88,COMPLETE
50,0.9431269075007086,2026-06-08 13:35:10.170738,2026-06-08 13:35:10.399421,0 days 00:00:00.228683,log_loss,9,3,8,83,COMPLETE
51,0.9493784739057416,2026-06-08 13:35:10.399451,2026-06-08 13:35:10.680034,0 days 00:00:00.280583,log_loss,10,2,3,90,COMPLETE
52,0.9137581306668728,2026-06-08 13:35:10.680065,2026-06-08 13:35:10.936296,0 days 00:00:00.256231,entropy,4,1,2,95,COMPLETE
53,0.9493784739057416,2026-06-08 13:35:10.936322,2026-06-08 13:35:11.198511,0 days 00:00:00.262189,log_loss,10,2,3,99,COMPLETE
54,0.9487577676122482,2026-06-08 13:35:11.198549,2026-06-08 13:35:11.456999,0 days 00:00:00.258450,entropy,10,3,4,87,COMPLETE
55,0.9493808161936416,2026-06-08 13:35:11.457023,2026-06-08 13:35:11.709164,0 days 00:00:00.252141,entropy,9,2,2,83,COMPLETE
56,0.9418819814818719,2026-06-08 13:35:11.709195,2026-06-08 13:35:11.930162,0 days 00:00:00.220967,entropy,8,1,2,76,COMPLETE
57,0.9412542483246785,2026-06-08 13:35:11.930192,2026-06-08 13:35:12.151546,0 days 00:00:00.221354,log_loss,9,6,5,81,COMPLETE
58,0.9406288574553852,2026-06-08 13:35:12.151576,2026-06-08 13:35:12.338097,0 days 00:00:00.186521,entropy,9,4,10,59,COMPLETE
59,0.9506327690761781,2026-06-08 13:35:12.338126,2026-06-08 13:35:12.602632,0 days 00:00:00.264506,entropy,9,3,6,100,COMPLETE
