number,value,datetime_start,datetime_complete,duration,params_criterion,params_max_depth,params_min_samples_leaf,params_min_samples_split,params_n_estimators,state
0,0.7674710910005027,2026-06-08 13:40:47.488579,2026-06-08 13:40:47.654571,0 days 00:00:00.165992,gini,10,1,4,44,COMPLETE
1,0.7482403217697335,2026-06-08 13:40:47.654595,2026-06-08 13:40:47.843831,0 days 00:00:00.189236,log_loss,7,3,17,88,COMPLETE
2,0.7805429864253393,2026-06-08 13:40:47.843850,2026-06-08 13:40:47.952388,0 days 00:00:00.108538,entropy,4,7,7,26,COMPLETE
3,0.7933634992458521,2026-06-08 13:40:47.952412,2026-06-08 13:40:48.064541,0 days 00:00:00.112129,log_loss,5,6,5,22,COMPLETE
4,0.7613122171945701,2026-06-08 13:40:48.064597,2026-06-08 13:40:48.236106,0 days 00:00:00.171509,gini,3,10,20,63,COMPLETE
5,0.793489190548014,2026-06-08 13:40:48.236129,2026-06-08 13:40:48.413426,0 days 00:00:00.177297,entropy,5,5,4,83,COMPLETE
6,0.7741327300150829,2026-06-08 13:40:48.413450,2026-06-08 13:40:48.512774,0 days 00:00:00.099324,entropy,10,6,11,13,COMPLETE
7,0.7613122171945701,2026-06-08 13:40:48.512799,2026-06-08 13:40:48.620256,0 days 00:00:00.107457,entropy,10,10,13,26,COMPLETE
8,0.7805429864253393,2026-06-08 13:40:48.620280,2026-06-08 13:40:48.724553,0 days 00:00:00.104273,log_loss,4,9,7,18,COMPLETE
9,0.7677224736048265,2026-06-08 13:40:48.724575,2026-06-08 13:40:48.890829,0 days 00:00:00.166254,log_loss,5,10,3,42,COMPLETE
10,0.7869532428355958,2026-06-08 13:40:48.890853,2026-06-08 13:40:49.117366,0 days 00:00:00.226513,entropy,7,4,10,98,COMPLETE
11,0.7677224736048265,2026-06-08 13:40:49.117388,2026-06-08 13:40:49.286736,0 days 00:00:00.169348,log_loss,6,7,2,72,COMPLETE
12,0.7805429864253393,2026-06-08 13:40:49.286757,2026-06-08 13:40:49.477305,0 days 00:00:00.190548,entropy,6,4,6,79,COMPLETE
13,0.8063097033685268,2026-06-08 13:40:49.477326,2026-06-08 13:40:49.644186,0 days 00:00:00.166860,log_loss,8,5,5,49,COMPLETE
14,0.7738813474107592,2026-06-08 13:40:49.644210,2026-06-08 13:40:49.811593,0 days 00:00:00.167383,gini,8,2,9,55,COMPLETE
15,0.7869532428355958,2026-06-08 13:40:49.811615,2026-06-08 13:40:49.975987,0 days 00:00:00.164372,log_loss,8,4,14,47,COMPLETE
16,0.8063097033685268,2026-06-08 13:40:49.976008,2026-06-08 13:40:50.145550,0 days 00:00:00.169542,entropy,8,5,2,68,COMPLETE
17,0.7805429864253393,2026-06-08 13:40:50.145572,2026-06-08 13:40:50.317805,0 days 00:00:00.172233,log_loss,9,8,2,63,COMPLETE
18,0.8063097033685268,2026-06-08 13:40:50.317828,2026-06-08 13:40:50.428342,0 days 00:00:00.110514,entropy,8,5,8,37,COMPLETE
19,0.774007038712921,2026-06-08 13:40:50.428361,2026-06-08 13:40:50.592047,0 days 00:00:00.163686,gini,9,3,5,64,COMPLETE
20,0.7869532428355958,2026-06-08 13:40:50.592068,2026-06-08 13:40:50.755057,0 days 00:00:00.162989,entropy,9,7,13,54,COMPLETE
21,0.8127199597787832,2026-06-08 13:40:50.755077,2026-06-08 13:40:50.870183,0 days 00:00:00.115106,entropy,8,5,8,35,COMPLETE
22,0.8127199597787832,2026-06-08 13:40:50.870203,2026-06-08 13:40:50.981453,0 days 00:00:00.111250,entropy,7,5,6,33,COMPLETE
23,0.7998994469582704,2026-06-08 13:40:50.981476,2026-06-08 13:40:51.095467,0 days 00:00:00.113991,entropy,7,6,9,33,COMPLETE
24,0.7998994469582704,2026-06-08 13:40:51.095487,2026-06-08 13:40:51.199166,0 days 00:00:00.103679,entropy,7,3,7,33,COMPLETE
25,0.8061840120663649,2026-06-08 13:40:51.199184,2026-06-08 13:40:51.379403,0 days 00:00:00.180219,log_loss,9,4,5,49,COMPLETE
26,0.8063097033685268,2026-06-08 13:40:51.379428,2026-06-08 13:40:51.492298,0 days 00:00:00.112870,entropy,6,5,9,37,COMPLETE
27,0.7805429864253394,2026-06-08 13:40:51.492321,2026-06-08 13:40:51.655694,0 days 00:00:00.163373,entropy,8,8,11,53,COMPLETE
28,0.7546505781799899,2026-06-08 13:40:51.655716,2026-06-08 13:40:51.766225,0 days 00:00:00.110509,gini,7,2,6,33,COMPLETE
29,0.7804172951231775,2026-06-08 13:40:51.766248,2026-06-08 13:40:51.898124,0 days 00:00:00.131876,log_loss,9,1,4,42,COMPLETE
30,0.7611865258924082,2026-06-08 13:40:51.898147,2026-06-08 13:40:51.999212,0 days 00:00:00.101065,gini,8,6,8,13,COMPLETE
31,0.7997737556561085,2026-06-08 13:40:51.999234,2026-06-08 13:40:52.174239,0 days 00:00:00.175005,entropy,8,5,3,67,COMPLETE
32,0.8063097033685268,2026-06-08 13:40:52.174261,2026-06-08 13:40:52.348181,0 days 00:00:00.173920,entropy,7,5,3,71,COMPLETE
33,0.7997737556561085,2026-06-08 13:40:52.348203,2026-06-08 13:40:52.510383,0 days 00:00:00.162180,entropy,8,4,6,59,COMPLETE
34,0.7869532428355958,2026-06-08 13:40:52.510401,2026-06-08 13:40:52.623009,0 days 00:00:00.112608,entropy,6,7,4,27,COMPLETE
35,0.7997737556561085,2026-06-08 13:40:52.623029,2026-06-08 13:40:52.789663,0 days 00:00:00.166634,entropy,7,6,2,46,COMPLETE
36,0.7998994469582704,2026-06-08 13:40:52.789687,2026-06-08 13:40:52.905487,0 days 00:00:00.115800,log_loss,10,3,5,39,COMPLETE
37,0.7741327300150829,2026-06-08 13:40:52.905508,2026-06-08 13:40:53.016050,0 days 00:00:00.110542,entropy,9,5,17,22,COMPLETE
38,0.7997737556561085,2026-06-08 13:40:53.016074,2026-06-08 13:40:53.183327,0 days 00:00:00.167253,entropy,8,6,8,51,COMPLETE
39,0.7997737556561085,2026-06-08 13:40:53.183350,2026-06-08 13:40:53.351268,0 days 00:00:00.167918,log_loss,7,4,6,58,COMPLETE
40,0.7677224736048265,2026-06-08 13:40:53.351290,2026-06-08 13:40:53.519494,0 days 00:00:00.168204,entropy,3,7,4,78,COMPLETE
41,0.8063097033685268,2026-06-08 13:40:53.519514,2026-06-08 13:40:53.627018,0 days 00:00:00.107504,entropy,8,5,8,30,COMPLETE
42,0.8063097033685268,2026-06-08 13:40:53.627040,2026-06-08 13:40:53.756542,0 days 00:00:00.129502,entropy,8,5,10,37,COMPLETE
43,0.7933634992458521,2026-06-08 13:40:53.756562,2026-06-08 13:40:53.867836,0 days 00:00:00.111274,entropy,9,6,7,21,COMPLETE
44,0.8063097033685268,2026-06-08 13:40:53.867861,2026-06-08 13:40:54.034823,0 days 00:00:00.166962,entropy,7,5,7,43,COMPLETE
45,0.7933634992458521,2026-06-08 13:40:54.034844,2026-06-08 13:40:54.151884,0 days 00:00:00.117040,entropy,8,4,11,39,COMPLETE
46,0.7869532428355958,2026-06-08 13:40:54.151907,2026-06-08 13:40:54.262922,0 days 00:00:00.111015,log_loss,10,6,3,27,COMPLETE
47,0.7804172951231775,2026-06-08 13:40:54.262946,2026-06-08 13:40:54.425857,0 days 00:00:00.162911,gini,6,4,10,47,COMPLETE
48,0.8063097033685268,2026-06-08 13:40:54.425881,2026-06-08 13:40:54.616849,0 days 00:00:00.190968,entropy,7,5,5,87,COMPLETE
49,0.7804172951231775,2026-06-08 13:40:54.616871,2026-06-08 13:40:54.724241,0 days 00:00:00.107370,log_loss,5,3,13,19,COMPLETE
50,0.7677224736048265,2026-06-08 13:40:54.724262,2026-06-08 13:40:54.954895,0 days 00:00:00.230633,entropy,8,7,8,94,COMPLETE
51,0.8063097033685268,2026-06-08 13:40:54.954930,2026-06-08 13:40:55.064494,0 days 00:00:00.109564,entropy,6,5,9,36,COMPLETE
52,0.793489190548014,2026-06-08 13:40:55.064516,2026-06-08 13:40:55.173329,0 days 00:00:00.108813,entropy,4,5,9,30,COMPLETE
53,0.7998994469582704,2026-06-08 13:40:55.173354,2026-06-08 13:40:55.287844,0 days 00:00:00.114490,entropy,5,6,7,41,COMPLETE
54,0.7997737556561085,2026-06-08 13:40:55.287869,2026-06-08 13:40:55.402680,0 days 00:00:00.114811,entropy,7,4,10,34,COMPLETE
55,0.7805429864253394,2026-06-08 13:40:55.402700,2026-06-08 13:40:55.529306,0 days 00:00:00.126606,entropy,6,8,12,24,COMPLETE
56,0.7483660130718954,2026-06-08 13:40:55.529335,2026-06-08 13:40:55.643108,0 days 00:00:00.113773,gini,6,4,19,30,COMPLETE
57,0.7997737556561085,2026-06-08 13:40:55.643128,2026-06-08 13:40:55.811967,0 days 00:00:00.168839,log_loss,9,6,6,45,COMPLETE
58,0.8063097033685268,2026-06-08 13:40:55.811989,2026-06-08 13:40:55.981107,0 days 00:00:00.169118,entropy,8,5,8,57,COMPLETE
59,0.7997737556561085,2026-06-08 13:40:55.981126,2026-06-08 13:40:56.146144,0 days 00:00:00.165018,entropy,7,5,9,61,COMPLETE
