number,value,datetime_start,datetime_complete,duration,params_criterion,params_max_depth,params_min_samples_leaf,params_min_samples_split,params_n_estimators,state
0,0.7994791666666666,2026-06-08 13:35:50.726893,2026-06-08 13:35:50.887246,0 days 00:00:00.160353,gini,10,1,4,44,COMPLETE
1,0.80078125,2026-06-08 13:35:50.887269,2026-06-08 13:35:51.094733,0 days 00:00:00.207464,log_loss,7,3,17,88,COMPLETE
2,0.8046875,2026-06-08 13:35:51.094761,2026-06-08 13:35:51.194825,0 days 00:00:00.100064,entropy,4,7,7,26,COMPLETE
3,0.8059895833333334,2026-06-08 13:35:51.194848,2026-06-08 13:35:51.302683,0 days 00:00:00.107835,log_loss,5,6,5,22,COMPLETE
4,0.8098958333333334,2026-06-08 13:35:51.302707,2026-06-08 13:35:51.474198,0 days 00:00:00.171491,gini,3,10,20,63,COMPLETE
5,0.8020833333333334,2026-06-08 13:35:51.474220,2026-06-08 13:35:51.696927,0 days 00:00:00.222707,entropy,5,5,4,83,COMPLETE
6,0.8138020833333334,2026-06-08 13:35:51.696953,2026-06-08 13:35:51.792995,0 days 00:00:00.096042,entropy,10,6,11,13,COMPLETE
7,0.8059895833333334,2026-06-08 13:35:51.793016,2026-06-08 13:35:51.904661,0 days 00:00:00.111645,entropy,10,10,13,26,COMPLETE
8,0.8072916666666666,2026-06-08 13:35:51.904685,2026-06-08 13:35:52.016290,0 days 00:00:00.111605,log_loss,4,9,7,18,COMPLETE
9,0.8125,2026-06-08 13:35:52.016315,2026-06-08 13:35:52.181494,0 days 00:00:00.165179,log_loss,5,10,3,42,COMPLETE
10,0.80859375,2026-06-08 13:35:52.181518,2026-06-08 13:35:52.284561,0 days 00:00:00.103043,entropy,8,4,12,11,COMPLETE
11,0.80859375,2026-06-08 13:35:52.284587,2026-06-08 13:35:52.447939,0 days 00:00:00.163352,log_loss,7,8,9,46,COMPLETE
12,0.8059895833333334,2026-06-08 13:35:52.447960,2026-06-08 13:35:52.608910,0 days 00:00:00.160950,entropy,9,7,2,69,COMPLETE
13,0.7994791666666666,2026-06-08 13:35:52.608931,2026-06-08 13:35:52.770059,0 days 00:00:00.161128,log_loss,6,2,15,38,COMPLETE
14,0.8020833333333334,2026-06-08 13:35:52.770081,2026-06-08 13:35:52.935855,0 days 00:00:00.165774,gini,8,5,9,37,COMPLETE
15,0.8059895833333334,2026-06-08 13:35:52.935881,2026-06-08 13:35:53.104560,0 days 00:00:00.168679,entropy,6,8,10,56,COMPLETE
16,0.8059895833333334,2026-06-08 13:35:53.104584,2026-06-08 13:35:53.321920,0 days 00:00:00.217336,log_loss,8,9,15,100,COMPLETE
17,0.8151041666666666,2026-06-08 13:35:53.321940,2026-06-08 13:35:53.419083,0 days 00:00:00.097143,log_loss,5,4,2,12,COMPLETE
18,0.7994791666666666,2026-06-08 13:35:53.419107,2026-06-08 13:35:53.519733,0 days 00:00:00.100626,entropy,3,4,20,12,COMPLETE
19,0.8072916666666666,2026-06-08 13:35:53.519755,2026-06-08 13:35:53.685989,0 days 00:00:00.166234,gini,9,3,7,32,COMPLETE
20,0.7955729166666666,2026-06-08 13:35:53.686012,2026-06-08 13:35:53.794444,0 days 00:00:00.108432,log_loss,4,6,18,16,COMPLETE
21,0.8059895833333334,2026-06-08 13:35:53.794466,2026-06-08 13:35:53.896065,0 days 00:00:00.101599,log_loss,5,4,2,10,COMPLETE
22,0.7981770833333334,2026-06-08 13:35:53.896092,2026-06-08 13:35:54.037631,0 days 00:00:00.141539,log_loss,6,1,5,29,COMPLETE
23,0.80859375,2026-06-08 13:35:54.037656,2026-06-08 13:35:54.199639,0 days 00:00:00.161983,log_loss,5,7,2,50,COMPLETE
24,0.8046875,2026-06-08 13:35:54.199661,2026-06-08 13:35:54.360898,0 days 00:00:00.161237,log_loss,7,3,4,37,COMPLETE
25,0.8046875,2026-06-08 13:35:54.360921,2026-06-08 13:35:54.471905,0 days 00:00:00.110984,entropy,4,5,14,19,COMPLETE
26,0.8033854166666666,2026-06-08 13:35:54.471927,2026-06-08 13:35:54.643994,0 days 00:00:00.172067,log_loss,6,9,6,58,COMPLETE
27,0.8020833333333334,2026-06-08 13:35:54.644016,2026-06-08 13:35:54.805910,0 days 00:00:00.161894,log_loss,5,2,11,67,COMPLETE
28,0.8072916666666666,2026-06-08 13:35:54.805928,2026-06-08 13:35:54.917864,0 days 00:00:00.111936,entropy,9,6,3,31,COMPLETE
29,0.8033854166666666,2026-06-08 13:35:54.917883,2026-06-08 13:35:55.080815,0 days 00:00:00.162932,gini,10,8,8,44,COMPLETE
30,0.80859375,2026-06-08 13:35:55.080838,2026-06-08 13:35:55.291431,0 days 00:00:00.210593,gini,3,2,5,76,COMPLETE
31,0.8072916666666666,2026-06-08 13:35:55.291453,2026-06-08 13:35:55.458484,0 days 00:00:00.167031,gini,3,10,3,62,COMPLETE
32,0.80859375,2026-06-08 13:35:55.458502,2026-06-08 13:35:55.610925,0 days 00:00:00.152423,gini,4,10,18,49,COMPLETE
33,0.8072916666666666,2026-06-08 13:35:55.610948,2026-06-08 13:35:55.798404,0 days 00:00:00.187456,gini,3,9,20,75,COMPLETE
34,0.8072916666666666,2026-06-08 13:35:55.798427,2026-06-08 13:35:55.908524,0 days 00:00:00.110097,gini,5,10,16,21,COMPLETE
35,0.8046875,2026-06-08 13:35:55.908547,2026-06-08 13:35:56.068890,0 days 00:00:00.160343,log_loss,4,8,12,63,COMPLETE
36,0.80859375,2026-06-08 13:35:56.068912,2026-06-08 13:35:56.179850,0 days 00:00:00.110938,entropy,7,7,17,25,COMPLETE
37,0.8020833333333334,2026-06-08 13:35:56.179873,2026-06-08 13:35:56.385732,0 days 00:00:00.205859,gini,5,4,3,83,COMPLETE
38,0.8020833333333334,2026-06-08 13:35:56.385751,2026-06-08 13:35:56.490140,0 days 00:00:00.104389,log_loss,4,10,6,16,COMPLETE
39,0.8020833333333334,2026-06-08 13:35:56.490164,2026-06-08 13:35:56.705637,0 days 00:00:00.215473,entropy,10,6,4,95,COMPLETE
40,0.8033854166666666,2026-06-08 13:35:56.705659,2026-06-08 13:35:56.866005,0 days 00:00:00.160346,log_loss,6,9,13,42,COMPLETE
41,0.8046875,2026-06-08 13:35:56.866026,2026-06-08 13:35:56.967399,0 days 00:00:00.101373,entropy,8,4,11,10,COMPLETE
42,0.8046875,2026-06-08 13:35:56.967425,2026-06-08 13:35:57.074689,0 days 00:00:00.107264,entropy,9,3,9,14,COMPLETE
43,0.8020833333333334,2026-06-08 13:35:57.074711,2026-06-08 13:35:57.183510,0 days 00:00:00.108799,entropy,8,5,19,23,COMPLETE
44,0.80859375,2026-06-08 13:35:57.183534,2026-06-08 13:35:57.295234,0 days 00:00:00.111700,entropy,7,4,16,18,COMPLETE
45,0.8020833333333334,2026-06-08 13:35:57.295259,2026-06-08 13:35:57.455283,0 days 00:00:00.160024,entropy,10,5,8,52,COMPLETE
46,0.80078125,2026-06-08 13:35:57.455306,2026-06-08 13:35:57.561022,0 days 00:00:00.105716,entropy,8,1,14,14,COMPLETE
47,0.8059895833333334,2026-06-08 13:35:57.561047,2026-06-08 13:35:57.672118,0 days 00:00:00.111071,log_loss,9,3,10,27,COMPLETE
48,0.8020833333333334,2026-06-08 13:35:57.672142,2026-06-08 13:35:57.835272,0 days 00:00:00.163130,gini,7,9,12,34,COMPLETE
49,0.7994791666666666,2026-06-08 13:35:57.835297,2026-06-08 13:35:57.946561,0 days 00:00:00.111264,entropy,6,7,2,22,COMPLETE
50,0.8072916666666666,2026-06-08 13:35:57.946583,2026-06-08 13:35:58.123408,0 days 00:00:00.176825,log_loss,3,8,6,69,COMPLETE
51,0.8072916666666666,2026-06-08 13:35:58.123430,2026-06-08 13:35:58.283478,0 days 00:00:00.160048,log_loss,8,9,9,45,COMPLETE
52,0.8125,2026-06-08 13:35:58.283501,2026-06-08 13:35:58.450794,0 days 00:00:00.167293,log_loss,7,10,10,54,COMPLETE
53,0.8059895833333334,2026-06-08 13:35:58.450814,2026-06-08 13:35:58.617368,0 days 00:00:00.166554,log_loss,6,10,11,58,COMPLETE
54,0.8098958333333334,2026-06-08 13:35:58.617390,2026-06-08 13:35:58.780741,0 days 00:00:00.163351,log_loss,7,10,13,53,COMPLETE
55,0.8125,2026-06-08 13:35:58.780762,2026-06-08 13:35:58.945757,0 days 00:00:00.164995,log_loss,7,10,13,54,COMPLETE
56,0.8125,2026-06-08 13:35:58.945779,2026-06-08 13:35:59.106939,0 days 00:00:00.161160,log_loss,5,10,10,61,COMPLETE
57,0.8033854166666666,2026-06-08 13:35:59.106957,2026-06-08 13:35:59.265662,0 days 00:00:00.158705,log_loss,5,9,10,60,COMPLETE
58,0.8059895833333334,2026-06-08 13:35:59.265683,2026-06-08 13:35:59.427430,0 days 00:00:00.161747,log_loss,5,10,8,67,COMPLETE
59,0.8098958333333334,2026-06-08 13:35:59.427451,2026-06-08 13:35:59.601460,0 days 00:00:00.174009,log_loss,6,10,10,40,COMPLETE
