number,value,datetime_start,datetime_complete,duration,params_criterion,params_max_depth,params_min_samples_leaf,params_min_samples_split,params_n_estimators,state
0,0.8735632183908045,2026-06-08 13:33:18.808323,2026-06-08 13:33:18.949451,0 days 00:00:00.141128,gini,10,1,4,44,COMPLETE
1,0.8544061302681992,2026-06-08 13:33:18.949473,2026-06-08 13:33:19.143155,0 days 00:00:00.193682,log_loss,7,3,17,88,COMPLETE
2,0.8352490421455938,2026-06-08 13:33:19.143177,2026-06-08 13:33:19.236242,0 days 00:00:00.093065,entropy,4,7,7,26,COMPLETE
3,0.8620689655172414,2026-06-08 13:33:19.236264,2026-06-08 13:33:19.329881,0 days 00:00:00.093617,log_loss,5,6,5,22,COMPLETE
4,0.8122605363984675,2026-06-08 13:33:19.329908,2026-06-08 13:33:19.472561,0 days 00:00:00.142653,gini,3,10,20,63,COMPLETE
5,0.8544061302681992,2026-06-08 13:33:19.472584,2026-06-08 13:33:19.663244,0 days 00:00:00.190660,entropy,5,5,4,83,COMPLETE
6,0.8620689655172414,2026-06-08 13:33:19.663275,2026-06-08 13:33:19.751049,0 days 00:00:00.087774,entropy,10,6,11,13,COMPLETE
7,0.8084291187739464,2026-06-08 13:33:19.751079,2026-06-08 13:33:19.846639,0 days 00:00:00.095560,entropy,10,10,13,26,COMPLETE
8,0.8160919540229884,2026-06-08 13:33:19.846666,2026-06-08 13:33:19.939309,0 days 00:00:00.092643,log_loss,4,9,7,18,COMPLETE
9,0.8160919540229884,2026-06-08 13:33:19.939338,2026-06-08 13:33:20.083205,0 days 00:00:00.143867,log_loss,5,10,3,42,COMPLETE
10,0.8773946360153256,2026-06-08 13:33:20.083228,2026-06-08 13:33:20.230672,0 days 00:00:00.147444,gini,8,1,10,56,COMPLETE
11,0.8697318007662834,2026-06-08 13:33:20.230697,2026-06-08 13:33:20.375349,0 days 00:00:00.144652,gini,8,1,11,56,COMPLETE
12,0.8773946360153256,2026-06-08 13:33:20.375370,2026-06-08 13:33:20.516966,0 days 00:00:00.141596,gini,8,1,8,41,COMPLETE
13,0.8659003831417623,2026-06-08 13:33:20.516991,2026-06-08 13:33:20.668395,0 days 00:00:00.151404,gini,8,3,9,70,COMPLETE
14,0.8620689655172414,2026-06-08 13:33:20.668418,2026-06-08 13:33:20.809073,0 days 00:00:00.140655,gini,8,3,14,41,COMPLETE
15,0.8735632183908045,2026-06-08 13:33:20.809108,2026-06-08 13:33:20.988220,0 days 00:00:00.179112,gini,7,2,8,77,COMPLETE
16,0.8620689655172414,2026-06-08 13:33:20.988243,2026-06-08 13:33:21.182405,0 days 00:00:00.194162,gini,9,4,14,100,COMPLETE
17,0.8735632183908045,2026-06-08 13:33:21.182424,2026-06-08 13:33:21.321392,0 days 00:00:00.138968,gini,6,1,10,51,COMPLETE
18,0.8620689655172414,2026-06-08 13:33:21.321412,2026-06-08 13:33:21.418988,0 days 00:00:00.097576,gini,9,2,6,31,COMPLETE
19,0.8045977011494253,2026-06-08 13:33:21.419007,2026-06-08 13:33:21.563761,0 days 00:00:00.144754,gini,9,8,2,59,COMPLETE
20,0.8467432950191571,2026-06-08 13:33:21.563785,2026-06-08 13:33:21.661314,0 days 00:00:00.097529,gini,7,4,13,34,COMPLETE
21,0.8659003831417623,2026-06-08 13:33:21.661335,2026-06-08 13:33:21.800525,0 days 00:00:00.139190,gini,10,1,5,47,COMPLETE
22,0.8850574712643678,2026-06-08 13:33:21.800548,2026-06-08 13:33:21.941727,0 days 00:00:00.141179,gini,9,2,9,39,COMPLETE
23,0.8773946360153256,2026-06-08 13:33:21.941752,2026-06-08 13:33:22.104890,0 days 00:00:00.163138,gini,8,2,9,66,COMPLETE
24,0.8773946360153256,2026-06-08 13:33:22.104914,2026-06-08 13:33:22.202526,0 days 00:00:00.097612,gini,9,2,9,34,COMPLETE
25,0.8620689655172414,2026-06-08 13:33:22.202548,2026-06-08 13:33:22.342115,0 days 00:00:00.139567,gini,6,4,12,52,COMPLETE
26,0.8620689655172414,2026-06-08 13:33:22.342147,2026-06-08 13:33:22.482331,0 days 00:00:00.140184,gini,8,1,17,38,COMPLETE
27,0.8620689655172414,2026-06-08 13:33:22.482369,2026-06-08 13:33:22.623998,0 days 00:00:00.141629,gini,9,3,7,48,COMPLETE
28,0.8544061302681992,2026-06-08 13:33:22.624029,2026-06-08 13:33:22.773921,0 days 00:00:00.149892,log_loss,7,2,10,70,COMPLETE
29,0.8697318007662834,2026-06-08 13:33:22.773951,2026-06-08 13:33:22.911752,0 days 00:00:00.137801,entropy,8,1,15,45,COMPLETE
30,0.8505747126436781,2026-06-08 13:33:22.911788,2026-06-08 13:33:23.059327,0 days 00:00:00.147539,gini,10,5,11,58,COMPLETE
31,0.8850574712643677,2026-06-08 13:33:23.059358,2026-06-08 13:33:23.210170,0 days 00:00:00.150812,gini,8,2,9,63,COMPLETE
32,0.8659003831417623,2026-06-08 13:33:23.210201,2026-06-08 13:33:23.366192,0 days 00:00:00.155991,gini,9,2,8,54,COMPLETE
33,0.8697318007662836,2026-06-08 13:33:23.366225,2026-06-08 13:33:23.566254,0 days 00:00:00.200029,gini,7,1,8,75,COMPLETE
34,0.8582375478927203,2026-06-08 13:33:23.566284,2026-06-08 13:33:23.739069,0 days 00:00:00.172785,gini,6,3,6,62,COMPLETE
35,0.8659003831417623,2026-06-08 13:33:23.739100,2026-06-08 13:33:23.879077,0 days 00:00:00.139977,log_loss,8,2,10,37,COMPLETE
36,0.8582375478927203,2026-06-08 13:33:23.879114,2026-06-08 13:33:23.977397,0 days 00:00:00.098283,gini,9,3,5,27,COMPLETE
37,0.8697318007662834,2026-06-08 13:33:23.977437,2026-06-08 13:33:24.120233,0 days 00:00:00.142796,entropy,7,1,12,49,COMPLETE
38,0.8275862068965517,2026-06-08 13:33:24.120265,2026-06-08 13:33:24.318661,0 days 00:00:00.198396,gini,8,7,6,85,COMPLETE
39,0.8620689655172414,2026-06-08 13:33:24.318692,2026-06-08 13:33:24.415386,0 days 00:00:00.096694,entropy,10,4,8,20,COMPLETE
40,0.8275862068965517,2026-06-08 13:33:24.415435,2026-06-08 13:33:24.593391,0 days 00:00:00.177956,log_loss,3,5,20,65,COMPLETE
41,0.8812260536398467,2026-06-08 13:33:24.593444,2026-06-08 13:33:24.784680,0 days 00:00:00.191236,gini,8,2,9,69,COMPLETE
42,0.8850574712643677,2026-06-08 13:33:24.784711,2026-06-08 13:33:24.971382,0 days 00:00:00.186671,gini,8,2,10,81,COMPLETE
43,0.8735632183908045,2026-06-08 13:33:24.971427,2026-06-08 13:33:25.183446,0 days 00:00:00.212019,gini,7,3,10,94,COMPLETE
44,0.8773946360153256,2026-06-08 13:33:25.183483,2026-06-08 13:33:25.375977,0 days 00:00:00.192494,gini,9,2,12,77,COMPLETE
45,0.8582375478927203,2026-06-08 13:33:25.376007,2026-06-08 13:33:25.566005,0 days 00:00:00.189998,gini,8,3,11,72,COMPLETE
46,0.8812260536398467,2026-06-08 13:33:25.566038,2026-06-08 13:33:25.761260,0 days 00:00:00.195222,gini,9,2,9,82,COMPLETE
47,0.8620689655172414,2026-06-08 13:33:25.761289,2026-06-08 13:33:25.954749,0 days 00:00:00.193460,entropy,9,2,9,82,COMPLETE
48,0.8582375478927203,2026-06-08 13:33:25.954775,2026-06-08 13:33:26.147556,0 days 00:00:00.192781,gini,10,6,7,91,COMPLETE
49,0.8620689655172414,2026-06-08 13:33:26.147583,2026-06-08 13:33:26.352333,0 days 00:00:00.204750,log_loss,9,2,9,81,COMPLETE
50,0.8582375478927203,2026-06-08 13:33:26.352358,2026-06-08 13:33:26.549858,0 days 00:00:00.197500,gini,10,4,7,86,COMPLETE
51,0.8812260536398467,2026-06-08 13:33:26.549900,2026-06-08 13:33:26.697051,0 days 00:00:00.147151,gini,8,1,10,61,COMPLETE
52,0.8735632183908045,2026-06-08 13:33:26.697077,2026-06-08 13:33:26.841361,0 days 00:00:00.144284,gini,8,1,11,67,COMPLETE
53,0.8582375478927203,2026-06-08 13:33:26.841383,2026-06-08 13:33:26.987760,0 days 00:00:00.146377,gini,4,3,10,61,COMPLETE
54,0.8812260536398467,2026-06-08 13:33:26.987787,2026-06-08 13:33:27.163545,0 days 00:00:00.175758,gini,9,2,11,74,COMPLETE
55,0.8812260536398467,2026-06-08 13:33:27.163568,2026-06-08 13:33:27.354940,0 days 00:00:00.191372,gini,7,1,9,80,COMPLETE
56,0.8084291187739464,2026-06-08 13:33:27.354964,2026-06-08 13:33:27.499896,0 days 00:00:00.144932,gini,8,9,8,69,COMPLETE
57,0.8773946360153256,2026-06-08 13:33:27.499918,2026-06-08 13:33:27.690433,0 days 00:00:00.190515,gini,8,2,13,96,COMPLETE
58,0.8773946360153256,2026-06-08 13:33:27.690459,2026-06-08 13:33:27.890671,0 days 00:00:00.200212,gini,9,1,12,90,COMPLETE
59,0.8505747126436781,2026-06-08 13:33:27.890698,2026-06-08 13:33:27.977144,0 days 00:00:00.086446,gini,7,3,4,11,COMPLETE
